subject	body	cluster_id
Three proposals, following up our recent meeting.	Dear Dr. Lay, We met less than a week ago, on Wednesday 16 May 2001, during the OECD Forum 2001 in Paris. I'm an independent consultant and innovator, with a special interest in energy and new technologies. I have more than ten years experience in research and innovation in economics, business and technology. I attended the session on energy you chaired during that OECD Forum. After the session, I had a discussion with you. Unfortunately, your time was too short. You gave me your card and asked me to write you. As I told you, I think I can add value to your staff, bring new lines of businesses to Enron and with them, many new clients. And above all, unprecedented profits. I am writing you to propose my contribution in these purposes. I'm mainly making three proposals to Enron. 1.- Working for Enron as an external consultant. Here, I would rather like to work on assignments, medium or long term, with a preference for the following jobs: risk assessment and/or management, strategic analysis on geopolitical, macroeconomics and societal issues. I think these are important tasks for a company like Enron. The current problems with Enron's Dabhol power plant in the Maharashtra state in India stresses the kind of importance I'm mentioning. I can also conduct surveys and provide Enron with technical and fruitful information and policy recommendations. I've done a job like that recently, on the oil-pipeline project in Chad and Cameroon. As you may already know, this is a $4 billion project recently launched, with the support of the World Bank, and led by three major energy firms: Exxon and Chevron of the USA, and Petronas of Malaysia. I wrote a detailed and long report, which combined public and private sectors' concerns, and also communities' interests. Having operations worldwide, Enron I think needs the type of technical works I've done on that major energy project. I have a good expertise in energy economics. I attend international congresses on that subject, for instance in Boston in January 2000. Since more than five years, as a journalist or as an independent consultant, I have been covering the works and studies of, or participated to workshops and seminar organized by, the IEA (International Energy Association). I know Mr. Robert Priddle, IEA chair, who also attended that energy session during the OECD Forum 2001. I know the work he and his team of experts have been doing. 2.- Being fully employed by Enron. In this respect, I would prefer to work as a researcher for either Enron Project Development and Management or Capital and Risk Management departments. In these fields, I've also innovated. I've created among concepts, tools and processes. For instance, the "Sensible Guide for Action". This is a tool theoretically powerful and practically very efficacious. It's main goal is to help decision-makers, in both private and public sectors. The Sensible Guide for Action assists them in their approach to solve technical problems. The SGA is a five-leaf bough. I've also created a method to assess a firm capacity to create wealth. This method can be adapted to fit some particular projects. The method is very useful in countries where there's no stocks market, and where capital markets are not sufficiently large. That's the case of underdeveloped countries in general, where yet the energy demand if forecast to grow the most in the coming decades. Enron cannot overlook this, or miss the business and profit opportunities in this growth. 3.- The Business of Businesses. Dear Dr Lay, if you accept this third proposal, it will probably be the best investment Enron has ever made. I'm an independent researcher and entrepreneur, with a strong quantitative analysis competence, and a multidisciplinary background, both by education and professionally. I'm a graduate in mathematics and in mechanical engineering (University of Paris) and also in business and economics (Institut d'Etudes Politiques of Paris). In this third proposal I'm bringing to Enron two key inventions I've made, two types of financial products targeting consumers and companies. I believe they will interest Enron. These products have a market potential worldwide, unlimited. They will create an entirely new industry: the business of businesses. I'm currently looking for investors with whom I can launch those products. We will be the world leader here, and remain in that position for a long time before copycats try to reach us. I've created the products, and nobody knows about them or about their extraordinary markets. I started to talk to you about these products when we met, but you were hurrying, and the many solicitations and noises of the Forum made it difficult to explain my point. I'm writing you as you asked me, because firstly I believe these products will interest Enron. Secondly I know how these products will boost three types of Enron services: Online Marketplace; Broadband Services; and Energy & Commodities. Plus, these products, and the business of businesses they create are an excellent placement for Enron. Among the many reasons why I believe my products will interest Enron are these: (i) Their market is global. (ii) They are directly related to consumption and savings. (iii) They're excellent saving vehicles, for instance for pension or life insurance. (iv) They concern payment transactions and transmissions (And thanks to information technology, costs here decrease while productivity will grow). (v) They are both offline and online business (These products will be excellent for Enron e-business). (vi) I want to be and remain a global leader. (vii) The products' growth potential is borderless (viii) There's no competitor and before copycats arrive we would have strongly imposed ourselves as The Leader and the Reference, increasing chances that customers remain faithful to us. (ix) My products will allow Enron to beat its competitors. (x) Enron will earn a lot of revenues, many new clients, and very big and unprecedented profits. I'm looking for investors willing to put around $7 million. Given that the revenues generated can very rapidly reach the range of $500 million to $1 billion, that initial $7 million is a wise and very profitable investment. If you're interested, I'm ready to present the products and its business scenario to you. The business model is very innovative, unprecedented. These products' market is the whole world. But the first three markets I would like to attack are the UK, Germany and moreover, Japan. Today's news about Japan is rather bad. Economists and many observers see a declining Japan. Me not. They may be right from a pure statistical and macroeconomic viewpoint. But they fail to see deeper. They overlook the other face of Japan. For my part, I see great business opportunities in Japan, today and for the coming decade. Particularly for the financial products I'm proposing. These financial products I want Enron to launch with me in Japan, perfectly fit Japanese consumption manners, their problematic pension system, and life insurance structure there. Public pension systems are under pressure every where, particularly in Japan. In Germany they are trying to reform it. But there's no consensus in the governments (federal and states') or in the Parliaments (federal and states'). Last week, Chancellor Gerhard Schr?der won some parliamentary approval. But the package he proposed is far from solving the issue. In the meantime, problems may accumulate, the situation could worsen. What seems sure is that in a foreseeable future, governments, not only in Germany but in all developed and ageing countries, will no longer be able to pay pensions at the level they have promised or are continuing to promise. An additional bad news, even company pensions will suffer. In today's "Financial Times" (Tuesday 22 May 2001, page 17), Peter Thompson, incoming chairman of the British National Association of Pension Funds "warned UK workers that they would no longer rely on comfortable company". He adds that "many wold have to work until they were 75 -- 10 years longer than the current retirement age - if they wanted to enjoy a financially comfortable old age". Therefore, workers and citizens should start, right no! to save for themselves. My products are here the best saving vehicle I know. And to what I know of Enron, it seems to me that Enron's shareholders also will appreciate the kind of new business and investment opportunity I'm bringing to their company. They will allow Enron to create a new and unprecedented business model that all its competitors will envy. In a way, Enron will change for its advantage, the way to do business in general, and energy business in particular, thanks to the "business of businesses" concept I've elaborated. Dear Dr. Lay, as I read in Enron's web site, the list of awards you have received: impressive. Congratulations! Two qualities common to all of them are leadership and creativity. I wish these will help you to catch the wonderful opportunity I'm bringing to you, in order to allow Enron to accomplish a phenomenal progress. Leadership and moreover creativity are also two qualities I've been trying to put into practice. This effort creates a sort of affinity between us. Thus, I think we can easily understand one another, speaking in some way, the same language. Hence an additional reason that brings me to write you and to make my proposal directly to you. Given what I've learned of Enron's vision and values, I would like to stress four of the twelve headings that are listed in Enron "vision and values" page: innovation, diversity, change and excellence. Four headings that are at work in each of the three proposals I've just made to you. When I knew you were coming to that Forum, I prepared some materials for you and was ready to present my proposals to you in details and to answer all your questions. I'm still ready to do it. I'm even ready to come to Houston for that purpose. In one recent Enron's ad, I read : "Enron: Endless possibilities". Let's make it true. Let's do it together. Let's reap the enormous benefits of "The Business of Businesses"! Thank you.	2
Agenda Items Number Two and Five for Wednesday 5:00 Meeting	Dear Ken: We have very serious offers out to two young - but very highly regarded - economists doing work in areas of interest to Enron. (Please see enclosed.) Hendricks is being recruited for one of the Lay family chairs. Rust, now at Yale, is being recruited for our new university-wide Center in Computational Economics and Finance. His work is likely to be of considerable interest to Enron. Malcolm	1
Partnership Information to Bernstein	Ken, Beau and I would like to share the family partnership and investment information with Bernstein to get their Family Wealth group up to speed. We think they can provide a perspective on diversification and they will do it at no cost and without an established relationship, unlike most of the investment banks. Painewebber needs your permission to release the information. Would you please send Rocky a letter authorizing Beau or me to release this information to third parties so we can move forward? Thanks, Mark	2
Board Position	Ken, I am interested in a Board position with a mid-market publicly traded company. I have 25 years of solid business experience with strengths in Finance, Technology, and Human Resources. I have served on numerous Non-profit Boards and have an excellent track record for my work. This position would also provide me the flexibility to spend some time in Washington DC to support the Bush Administration. Attached is my resume. Please review and provide feedback. Look forward to hearing from you. Will be out of the country from June 1-12, 2001.	0
RedDot Solutions	Kenneth: My name is Brian Skruch with RedDot Solutions. RedDot provides software that enables business users to simply maintain their web site by "clicking on the red dot". RedDot helps organizations manage and publish their Web or Intranet content to avoid Webmaster bottlenecks, inappropriate or costly errors, user frustration etc. In addition, we enable content contributors to add, modify, and specify appearance schedules for Web content without requiring any specific technical skills such as HTML. *) To see a product demonstration, please follow this link: http://www.RedDotSolutions.com/flash *) For general information on our product, please follow this link: http://www.reddotsolutions.com/products.html Please let me know if you would like further information, or if you would like to setup a meeting to review RedDot in action directly with your own Enron Corp website. Thanks, Brian	2
Request For Assistance	Mr. Lay: I would greatly appreciate your assistance in helping to strengthen a relationship EES has with Sysco Corporation. EES and Sysco began discussing a wide array of business opportunities with one another in the Fall of last year. On June 30th of this year, we entered into a 10 year electricity supply contract for all of Sysco's California facilities. We are currently pursuing two important Q4 transactions with Sysco; an electricity supply contract for their Texas facilities and a demand side management contract for all of their facilities. We had planned to close the Texas supply transaction today. However, in a phone conversation I had this morning with Sysco's Director of Procurement, Terry Taylor I was informed that Sysco's CEO, Charles Cotros has instructed Mr. Taylor not to enter into any further transactions with us "until Enron's financial picture clears up". Mr. Taylor believes that Mr. Cotros' concerns about Enron would be diminished if he received a call from a senior executive at Enron. Rosalee indicated that you and Mr. Cotros serve together on the Board of Directors for the Greater Houston Partnership. Would you please call Mr. Cotros and attempt to assuage his concerns about our financial condition. Mr. Cotros is out of the office until Thursday, November 1st. His direct phone number is (281) 584-1415. His assistant is Andrea Walters and her phone number is (281) 584-1405. Mr. Cotros' biography is as follows: Charles H. Cotros, age 64, has served as a director of SYSCO since 1985. Mr. Cotros has served as Chairman of the Board since July 2000 and as Chief Executive Officer since January 2000. He served as Chief Operating Officer from 1995 until January 2000 and as President from 1999 until July 2000. He has been employed by SYSCO since 1974. Mr. Cotros is Chairman of the Executive Committee and he is also a member of the Finance Committee. Source: Proxy, 9/24/01 Thank you in advance for your consideration and anticipated assistance. Otherwise, please let me know if you will not be able take the action requested and I will initiate an alternative plan. Respectfully, Craig Sutter X 31829	2
eAssist	Ken, I would like to like to schedule a meeting with you to discuss your corporate customer service initiatives. eAssist is the most highly sought after customer service solution within the Global 500 arena. eAssist's value proposition will provide you and your executive team the ability to consistently increase revenues, decrease operational costs, improve customer service and increase shareholder value. I look forward to hearing back from you as to your availability.	0
Harvard MBA, MSEE Univ of Southern CA, BT Engineering IIT.Strategic MKTG/Business Dev Exec	Dear Kenneth , I would like to inform you of an exceptional candidate ("AJM") who is seeking a mid-to-executive level Marketing/Business Development opportunity. Below is a brief profile of an individual who has demonstrated upward mobility in his career path and loyalty as an employee. His solid experience and education credentials are stellar. Professional Summary: Harvard MBA with over 15 years of corporate strategy, marketing, business development, and finance experience in the information technology industry with recent management positions at Microsoft Corporation and AT Kearney.v Executive Bio: Prior to joining a startup, AJM was a senior executive at Microsoft Corporation and managed the development and marketing of Microsoft's Biz Talk Server 2000 product, an XML integration server. In addition, he marketed the BackOffice Server product with more than $1 billion in sales. Prior to working at Microsoft, AJM worked as a management consultant with A.T. Kearney. At Kearney, he advised global Fortune 500 companies on strategic and management issues. His clients included financial institutions, high technology companies and IT service providers. Functionally, he has been involved in developing business strategy, market entry plans, new product development, sales force effectiveness, and re-engineering companies. Industry Disciplines: Industries Experience -Information Technology; the Internet (Enterprise Applications & Infrastructure); Financial Industries Served - Digital Economy; Financial Services; Fortune 500, Financial Institutions, Global IT, Consultanting Groups FORMAL EDUCATION 1994-1996 HARVARD BUSINESS SCHOOL Master in Business Administration, June 1996. General management - focus in marketing and finance. Graduated with distinction. Awarded Harvard Business School Fellowship, 1995-96 1987-1989 UNIVERSITY OF SOUTHERN CALIFORNIA Master of Science degree in Engineering, June 1989. Graduated first in the class. Received the Dean's Powell Research Fellowship Award. Received the Outstanding Academic Achievement Award. 1983-1987 INDIAN INSTITUTE OF TECHNOLOGY Bachelor of Technology degree in Engineering, 1987. Received Best Graduating Engineering Award, Atul Memorial Award and Indian Government Merit Scholarship. We will be happy come up with impressive Tier1 candidates to fill your executive staffing needs. if you take time in filling out this form which gives us a chance to work on your requirements. http://www.Tier1Execs.com/start.html Please contact Melissa Sezto via email Melissa@Tier1Execs.com for additional details.	2
Kathleen's Comments	Dad, I was talking with Kathleen this weekend and she had some ideas and suggestions about Enron. I asked her to put them in writing so that I could share them with you. I am attaching her memo. Please keep in mind, she loves her job, these are just ideas to make it that much better. I love you, Dad, Elizabeth	1
Information Security Executive	Dear Sir/Madam, This will introduce an exceptional Candidate for an Executive Level Information Security position. He has 19 years of VP level Information Security development, implementation and management at several of the most technologically advanced financial institutions including a $6 Billion/year stock brokerage (1995 - 2001), a $12 billion/year financial services conglomerate with interests in mutual funds, life insurance, banking and retirement services ( 1990- 1995), and a $50 billion/year bank( 1989-1990). He holds an MS in Systems Engineering and a BS in Mathematics. PhD course work completed. He is a Certified Information Systems Security Professional ( CISSP) and a Registered Brokerage Rep: Series 7 and Series 63. His primary love is building global Information Security programs and departments. He is receptive to working for smaller institutions and to relocation. For additional information on this candidate or to enquire about other Information Security executives please contact Gary Erlinger. Note: CIO Club is a Fee Based Staffing Organization.	2
-	Dear Ken, It has been many years since we talked. You may remember me as your neighbor in Park Grove many years ago. I have followed your career in all the business publications for many years and have cheered you on with the innovative business model you have constructed at Enron. The reason for my e-mail is to recommend Ginny's brother-in-law, Don Booker, for Employment at Enron. I have known Don since our days at Vanderbilt many years ago. He is a chemical engineer and has been with Scott Paper and with SAPPI, the company that purchased one on their mills in Muskegon, Michigan almost since graduation. He is the pulp and utilities mill manager and has experience in coal, gas and bio-mass co-generation. He will take early retirement from SAPPI soon and is looking to continue his career in the power generation area. Since your company is an innovator in this area I thought you might be able to refer Don to someone in your organization that could be of help. On a personal level, I can highly recommend Don as a dedicated, hard working and intelligent employee with the technical and management knowledge to make good business decisions. We have had many talks over the years about his management philosophy and I have always come away being impressed with both his management and leadership skills. Don conducts himself with a high degree of integrity which is an essential leadership requirement. Ken, as you can tell, I am highly recommending Don for a job at Enron. If you have an opening it would be in Enron's best interests to consider him. If I can be of further help give me a call at (407) 293-4000 or e-mail me at RDF@Finfrock.cc <mailto:RDF@Finfrock.cc> . You can contact Don directly at (616) 846-3177 or e-mail at DBooker@charterMI.net. Thanks for your attention Ken, and congratulations on your impressive story at Enron.	2
Press Release-IntraTel -- Unlimited Long Distance Phone Calls	Hi Kenneth, We are within a year anniversary attempt to arrange a meeting with you and our CEO Jack Nester in order to present Telecompression, and how we can cut "Enron Corp." by hundreds of millions off Long Distance phone bill. The second part of this email is to show how we are advancing toward this "Goal" and asking to allow us this meeting or a conference call with you. Telecompression Technologies announces IntraTel, groundbreaking new 40-1 Telecompression software that dramatically reduces intra-office long-distance phone bills. IntraTel, a revolutionary new 40-to-1 voice compression software solution that could shave millions of dollars off corporate long-distance telephone bills, has just been announced by Telecompression Technologies, Inc. (TTI) California. IntraTel, converts a company's LAN, WAN, intranet or VPN into the most advanced telephony communications system ever available. "For large corporations with multiple offices, campuses, including offices abroad, "this is the communications technology breakthrough everyone's been waiting for. It's easily the most significant cost-savings telecommunications tool of the past 50 years." IntraTel, is unique because of its dynamic bandwidth allocation and an unparalleled capacity of providing toll quality voice with up to 40-to-1 voice compression. It outpaces standard code compressions that can, at best, deliver voice at an 8-to-1 compression. This makes possible a level of compression, which TTI has trademarked as Telecompression, applicable across corporate enterprise networks regardless of bandwidth. "we can do all of this without sacrificing voice quality." IntraTel, which quickly installs on a Windows 2000 network, allows companies to immediately realize savings of thousands of dollars every month for calls to dispersed company facilities and their surrounding area codes. "For very large corporations with staffs and facilities all over the world, savings could easily run into the millions of dollars every year." IntraTel replaces a company's standard telephone communications with network-based PCs on any type of digital network. The company installs the IntraTel Server software on one or more network domain controllers or dedicated Windows 2000 workstations, and individual users can easily download the IntraTel Client software from the network. This gives each intra-company PC user, regardless of his or her global location, access to the program's unique cost-saving benefits and features. The program makes possible extremely high-quality PC-to-PC, PC-to-phone and phone-to-PC connections. It supports 10baseT, 100baseT, and 1000baseT, as well as optical-based networks. PBX features are included to facilitate user transition from conventional Telco-type systems to network-based telephony operations. IntraTel can support up to 65,000 users over a wide area intranet or VPN comprised of either copper, fiber, satellite, wireless or combined system. Other features include phone conferencing for up to eight individuals in multiple locations, whiteboard chat, optional voice mail lobby, text chat, file transfer and save-to-file, and more. Among the many options are IntraTel Phone Jump, which lets any user dial any phone number in an area code in which the company has both an IntraTel Access Server and a connected employee/user. In other words, if your San Francisco office has an employee in London with the IntraTel server and PC software in place, you could call any other phone number in that London area code without paying long-distance phone charges. The new IntraTel Encryption option. This solution gives businesses low-cost capabilities for protecting their worldwide telecommunications. IntraTel Encryption provides the highest level of secure voice, text and data transfer with channel-by-channel encryption. Each company receives and manages its own custom key store, giving it maximum security for sensitive communications."	2
