subject	body	cluster_id
Dynegy Discussions	Enron and Dynegy each announced today that they are holding discussions about a possible merger of the two companies. As you know, Dynegy is a major player in the energy marketplace, and is not only a competitor, but also a counterparty of Enron. This is just one of several options that we are considering. Upon receipt of this announcement, the NYSE briefly suspended trading of both Enron and Dynegy. We have no additional information we can share at this time. We'll keep you updated as developments occur.	2
Information	Mike, My contact information is as follows: cell: 713-412-0591 home: 713-526-9908 e-mail: jgualy@hotmail.com I really appreciate the help. If the people at Constellation or AEP need my resume, let me know and I will forward it to you or them. Thanks,	2
Senior Position	Mike: Please send me your resume or call me. I have senior position that I would like to discuss. Regards,	0
Job opportunities	Listed below are some of the positions available. You can also look at our postings on the PMA website for updates each week. If you're willing to look at positions outside Houston, we have some excellent opportunities. To make sure we stay in touch, drop us an email with the personal email address or telephone number where we might reach you. Rockwood Associates has been exclusively recruiting for domestic energy clients since 1985. We started by bringing Wall Street quantitative specialists of all levels to physical energy marketing and trading companies. Today, much of our power and natural gas search work breaks into three areas: (1) risk management and quantitative analysis, (2) structuring/planning, and (3) select assignments in physical power and gas trading. Other functional areas served: energy consulting, and derivatives marketing. We're always looking for individuals with strong analytical foundations for various positions. Experienced Financial Traders We have specific job openings in at least two locations outside of Houston for candidates with experience in power or natural gas OTC markets. These jobs complement the physical trading done in various US markets and the trader either hedges or takes proprietary positions. These jobs range from a mid-range job which offers total comp of $275-375K/yr or so to a more highly leveraged position where the person can make more for both the team and him or herself. One should have a minimum experience of derivatives trading of two years, and someone with more than 7-8 can be utilized as well. Strong options knowledge is a must. Power Marketing (EastCoast) This client firm is expanding into additional regions and needs someone with ECAR and adjacent grid experience. Candidate should have five or more years in the industry, have an in-depth knowledge of the power business and be respected in the power community. Client is a stable, solid power marketer with five years of systematic growth and management continuity. Firm has generation in various regions and can design and support structured transactions. The position offers all that a sales person might want: management support, a strong incentive plan and a good combination of personal responsibility and freedom to develop a marketplace in a systematic way. Term Marketer For Natural Gas (East Coast Location) A firm with excellent structuring/analytical support is looking for origination people with solid backgrounds in selling and structuring longer-term deals. Candidate should have customer contacts that are LDC's, power generators and large industrials in the Midwest. Be part of a small, tight-knit group that can use someone with good credentials and reward them accordingly. Energy Derivative Marketers (West Coast/East Coast) We have several openings for those who know derivatives and have successfully sold to energy producers and users. The right individual will have at least 2 years of experience and must be presently active in the marketplace. These are great positions for an independent-minded marketer who wants to build his/her own business within a business. The position will have terrific support from creative derivatives structuring groups. Contact: Charles R. Bamford, Partner Rockwood Associates P.O.Box 637 Spring Lake, NJ 07762 Email: RockwoodEnergy@aol.com	0
TEKsystems	Michelle- Good morning, and I hope that this e-mail finds you well. The reason for my message is to follow-up with you regarding the conversation myself, Darlene Donlan, and Greg DeLuca from our organization had with you a few weeks back. We had discussed making additions to the Enron master PWD and getting copies of Enron's Code of Ethics, background check requirements, and Enron's benefits package regarding the indemnification clause. Darlene, who is one of TEKsystems' Controllers, sent to your attention a copy of the revised PWD with payment terms and TEKsystems' services, and Mark has been working and communicating with myself regarding the other requested information. I just wanted to follow-up with you to see what additional steps, if any, that TEKsystems may need to take in order to continue moving forward in the contract execution process. If there is any additional information you may require of us on our end, please let me know and I will be happy to help assist in any way possible. I know that you are extremely busy, and that you probably have other, more pressing matters to spend your time on. Any feedback you could provide would be appreciated and most helpful. Thank you once again for your time and consideration, and I look forward to your response.	2
Glocap Legal Search- Attorneys Available for In-ho	Dear Michelle: I hope that you are well. Over the past six months, Glocap Legal Search has solidified its position as the nation's premier in-house legal recruiting firm. We have worked very hard to create a truly unique and powerful legal recruiting company. Glocap's selection by Forbes.com as the best recruiting website in the country was gratifying, but even more important are the positive reviews that we regularly receive from our clients. We recruit for Fortune 500 companies, major financial institutions, consulting companies, investment banks and many other public and private companies of all sizes. I am writing to ask for your help. Do you know anyone who might be interested in hearing more about us? I have briefly summarized a very small sample of the many truly outstanding, pre-screened attorneys available through our unique service. We have many more, in all practice areas and experience levels. Call me if you would like to discuss how we can be of service to your company. Attorneys available now include: 1. Northwestern University School of Law (cum laude) graduate has over 4 years experience working on computer software, intellectual property and internet related issues, with particular emphasis on e-commerce and complex licensing. This very highly regarded attorney seeks a corporation or financial institution that needs in house counsel for domestic and/or international tech law matters. Midwest preferred. 2. Currently a Managing Director of a major investment bank, this prominent attorney has also served as one of the top partners at an elite, blue-chip law firm. The attorney seeks new challenges as a GC/CFO/VP of Business Development at a media, telecommunications or related company. An awesome talent who has been extremely successful at each stage of their career. 3. A truly uniquely credentialed attorney who graduated Stanford Law School and has a graduate degree from Columbia, this candidate is also a shared recipient of the Pulitzer Prize for investigative reporting and writing. Currently a litigator at a top law firm, this attorney has the intelligence, writing ability, and work ethic to enhance any company's litigation department. Fluent in Spanish. 4. Georgetown Law Center (cum laude) and Stanford undergraduate has over four years experience advising both private and public companies on general business/corporate matters as well as venture and debt financings, licensing, mergers and acquisitons, and public offerings. Terrific experience in securities and corporate counseling. Available either in California or East Coast. 5. A talented attorney with over eight years experience doing project finance and lending, mergers and acquisitions, and capital markets transactions at two very prominent law firms. This Russian speaking attorney has represented investors, lenders, and multilateral agencies in power, energy and natural resources industry sectors, as well as financial services, IT and telecom clients in a wide variety of m & a matters. 6. This 1996 graduate of a highly regarded law school has over five years of solid general corporate experience. Great drafting skills and superb presence, this candidate will be a very welcome addition to any in house legal staff that seeks an intelligent, hard working and very well trained corporate generalist. 7. Attorney who graduated first in his law class is practicing corporate restructuring and reorganization at one of New York's premier law firms. Four years experience in all aspects of distressed debt transactions, including asset sales, plans of reorganization, asset-based financings, cross-border insolvency issues and strategic distressed acquisitions. Seeking in-house or investment banking position. 8. Yale Law School, Princeton University (magna cum laude). Senior VP of one of top financial institutions in the world, this attorney has played a leading legal, business, integration and managerial role in acquisitons, joint ventures, equity investments and divestitures. Also has broad epxerience in securities law at a top law firm. Very well spoke and personable, this candidate is interested in a senior business/GC type position. NY metro area. 9. Yale University (magna cum laude), Harvard Law School (cum laude) candidate with three years transactional experience at premier law firm before leaving to become general counsel at a new media company. Has broad corporate, real estate and and technology experience. Exceedlingly smart, conscientious, and energetic. This candidate will be an enormous asset to any company that hires him. Wants NY area only. 10. UChicago Law School, over five years extraordinary experience at both a top law firm and a premier incubator. Practice areas include corporate, securities, intellectual property, mergers & acquisitions, venture capital financings and technology. Dynamic, very highly regarded attorney also speaks mandarin chinese. Wants in-house or legal/business position in Southern California only. This is just a very small sample of the attorney/candidates that we work with. We can of course tailor our search to meet any specifications that you wish. Feel free to call us to discuss our service, or to refer us to a colleague that might be interested in hearing more about us, or to obtain references from our clients. I hope I will be speaking with you soon. Thank you for taking the time to consider our service.	0
Good to see you	Hi Monika, It was great to see you at our annual conference. I hope that you had a good time and enjoyed the services we provided. Let's keep in touch and let me know if I can provide any help for you in the future. Best, Dequan	1
Good to see you	Hi Monika, It was great to see you at our annual conference. I hope that you had a good time and enjoyed the services we provided. Let?s keep in touch and let me know if I can provide any help for you in the future.	1
MS Excel session with Eugenio	Hello Warriors, Would you be interested in learning MS Excel shortcuts & tricks from the Excel guru, Eugenio? If so, please email me & let me know what things you would like to learn. If there is enough interest, we will reserve a room and have Eugenio teach an Excel session next week. Ayesha	1
RE: Advice	Hi Monika - I have contacted the Head of the Finance Division at the University of Colorado in Boulder to see if they offer assistantships. He is my major professor from years ago. I will get back to you as soon as I hear from him. I am also forwarding to you in another email some info regarding potential employment at Tektronix. Even though they will be coming to OSU and you are in Texas, I would recommend that you forward your resume to them and tell them you got the information from me. Tell them to call me if they want to know more about you.	2
Your resume has been received	Thank you for your interest in employment opportunities at Tenaska. Your resume has been received and will be reviewed. You will be contacted if your qualifications meet our position requirements.	0
Position Opening: Real Time Trading Opportunity	Howdy all! We currently have an opening in the Real Time Trading Group reporting to Bill Williams III. If you have any questions about this position, please see Bill at the Real Time Desk. A list of responsibilities and candidate requirements can be found below. If you would like to be considered for this position, please contact Julie Kearney (x7404) or Grace Rodriguez (x8321) by close of business on Friday, October 19th, 2001. Regards, Grace x8321 =============================================== Open position - REAL TIME TRADING Description of Group Real Time Trading is responsible for the physical and financial integrity of prescheduled energy transactions. Specifically, this includes managing curtailed schedules and preserving Enron's financial rights with non-performing trading counter parties. The group is required to maintain records and update databases that explain such supply/market interruptions in order to minimize customer billing dispute issues. In addition, Real Time Trading is responsible for the hourly trading of energy in the California ISO and bilateral markets. Traders are expected to initiate profitable trades while maintaining an acceptable amount of risk exposure to the company. The group is expected to know all settlements requirements and charges related to each type of trade. Each trader is capable of interfacing with customers and responding to internal and external billing inquiries. Real Time is required to administer terms of Service Desk contracts, which may include the selling of excess generation and purchasing energy for customer's load requirements. Also, each trader is responsible for gathering and reporting information on unit outages, transmission line durations and other information that is useful for all West Desk trading activity. Description of Function Confirm purchases and sales of power for Enron Power Marketing. Protect EPMI from financial risk and fulfill physical power obligations. Trade energy in hourly markets, including California ISO. Gather essential market information for cash traders. Aid in the preparation of price and deal reports and assist in the resolution of volume/price discrepancies. Requirements Bachelors in Finance, Business, Accounting or related field. 1 to 2 years of previous power industry experience in western region is preferred. Excellent problem solving and communication skills. Ability to make quick decisions under pressure. Strong PC skills. Work rotating shift including holidays and weekends. Self-motivated. Detail oriented.	0
Welcome new hire: Kara Ausenhus	We are pleased to announce the arrival of Kara Ausenhus as the Assistant for the Government & Regulatory Affairs Group. Kara comes to us from EBS-Portland, where she worked with the Optical Engineering group. Prior to working at Enron, she worked with the Delaware State Chamber of Commerce as a Manager of Special Events on their Special Events/Communication Team. Please join us in welcoming Kara to ENA!	2
STEVE SUSMAN	Here is Steve's bio. I've also attached his CV, which shows his civic contributions. Let me know if you need anything else.	1
Summer Associates from UT School of Law	Dear General Counsels: On Monday, May 21, 2001, our two summer associates, Chike Okpara and Reginald Sewell will begin their summer rotation program with Enron. As you know, both of these gentlemen have just completed their first year of law school at the University of Texas School of Law. Our summer program is for twelve-thirteen weeks beginning on May 21, 2001 and ending on August 17, 2001. Since school begins on August 20, 2001, I anticipate that each student may wish to end his rotation during the week of August 13, 2001, thus leaving time for a brief vacation to be taken before school starts. Mr. Okpara's rotations are: May 21, 2001 through June 15, 2001 Corp. Legal/ETS Legal Dept. June 18, 2001 through July 13, 2001 Enron Global Finance Legal Dept. July 16, 2001 through August 17, 2001 Enron Wholesale Services Legal Dept. Mr. Sewell's rotations are: May 21, 2001 through June 15, 2001 Enron Global Finance Legal Dept. June 18, 2001 through July 13, 2001 Enron Broadband Services Legal Dept. July 16, 2001 through August 17, 2001 Enron Energy Services Legal Dept. Mr. Okpara and Mr. Sewell will attend New Hire Orientation on Monday, May 21, 2001. I will be at New Hire Orientation to meet and greet them. I will also present the Enron Code of Ethics. New Hire Orientation ends at noon. Following New Hire Orientation, I will take Mr. Okpara and Mr. Sewell to lunch. I anticipate introducing them to their first respective rotations at 2:00 pm on Monday, May 21, 2001. I have sent their resumes to you under separate cover. Thanks so much for your participation in this program. Please call me at 713-853-7224 if you have any questions.	2
Analyst & Associate Program - Summer Interns	I want to take a moment to thank each of you for having a summer Analyst or Associate work on your team. I also want to remind everyone what a high stakes activity this is for Enron. Based on your recommendation, we will make offers at the end of the summer to those interns who perform, and who you endorse as a potential future member of your team. Those interns who have had a good experience and accept our offer will be the lowest risk hires we make - from any source. We will have effectively interviewed and watched them work for 2-3 months. They also have the potential to be the most effective advocates and talent scouts we have, when they return to campus. On the flip side, those who don't have meaningful assignments, or have bad experiences during the summer can severely hurt our efforts. Thank you again for being part of this very important activity. If you have any questions, or if areas of concern arise during the summer, please contact Ted Bland (x35275), Traci Warner (x33242) or me (x36671). We appreciate your contributions to this important effort for Enron.	1
Re: Out of Office AutoReply: Outsourcing deal lawyer	James: I hope you were not offended when I wrote to you directly several weeks ago (without introduction) about my hopes to talk to you about a transactional lawyer position on your team. Might you need another hardworking, big firm trained lawyer with lots of complex outsourrcing and transactional experience? I think my training and experience would suit me well to hit the ground running. I would be thrilled with the chance to talk. Let me know and I can resend my resume. Look forward to talking soon.	1
Potential Corporate Legal Position	Gentlemen: It is my understanding that Ann Ballard will be leaving Enron soon. As a result of her departure, it is also my understanding that a new position may be created to handle federal compliance that would encompass matters related to the Federal Energy Regulatory Commission and the Federal Power Act. If so, I would like to be considered for the position. I have attached a copy of my resume below. I hold a Doctor of Jurisprudence from the University of Houston. While in law school I received an honors grade in Legal Research and Writing. Additionally, I possess an excellent command of the English language. I have approximately ten years of legal experience in the judicial, firm, and corporate environments. My experience includes preparation of documents for all phases of litigation from pre-trial through the appellate level, administration and drafting of natural gas contracts, administration of all contracts related to the acquisition of water and wastewater facilities on a worldwide basis, and monitoring asset compliance requirements. Currently, I act as a point of reference to various disciplines such as legal, tax, accounting, asset management, and restructuring. I also utilize the Secretariat database in my day-to-day activities. I possess extensive oral and written communication skills as a result of working in various legal environments. I am comfortable working with employees across all levels of Enron. During my tenure at Enron I have worked on the Federal Energy Regulatory Commission Annual Report of Interlocking Positions filing. This report is mandatory under Section 305(c)(1) of the Federal Power Act. Further, while at Texaco, I prepared the Canadian National Energy Board's monthly report for the export of natural gas from Canada and the U.S. Department of Energy's quarterly sales and price report for the import of natural gas from Canada. Please keep my inquiry regarding this position in confidence. I look forward to hearing from you. Sincerely, Monique V. Shankle Enron Corp.	0
RedDot Solutions	James: My name is Brian Skruch with RedDot Solutions. RedDot provides software that enables business users to simply maintain their web site by "clicking on the red dot". RedDot helps organizations manage and publish their Web or Intranet content to avoid Webmaster bottlenecks, inappropriate or costly errors, user frustration etc. In addition, we enable content contributors to add, modify, and specify appearance schedules for Web content without requiring any specific technical skills such as HTML. *) To see a product demonstration, please follow this link: http://www.RedDotSolutions.com/flash *) For general information on our product, please follow this link: http://www.reddotsolutions.com/products.html Please let me know if you would like further information, or if you would like to setup a meeting to review RedDot in action directly with your own Enron Corp website. Thanks, Brian	2
Quicksilver Resources	Ken and Jeff: Glen Darden, the President and CEO of Quicksilver Resources, Inc., is a longtime personal and professional friend of mine. Recently, he has asked whether I would consider serving as an outside Director on the Board of Directors of Quicksilver. Before meeting with Glen to discuss this further, I want to make sure that Enron does not have any objections. Headquartered in Fort Worth, Texas, Quicksilver is a natural gas and crude oil production company engaged in the development and acquisition of long-lived producing natural gas and oil properties. Quicksilver began trading publicly in March of 1999 on the American Stock Exchange (KWK). Quicksilver has a long standing business relationship with Enron. Enron has historically entered into pre-pays and hedging transactions related to natural gas production and continues to do so today. Enron (via JEDI) also provided some financing at the time of the merger of Quicksilver and Mercury Exploration and was a significant shareholder of Quicksilver at the time of its initial public offering. I believe JEDI has since divested this stockholding. If I were to serve on the board of Quicksilver, I expect that there will be related party transactions of a routine ongoing nature that would need to be disclosed and which I would need to abstain from voting on as a member of the board. However, I do not feel there would be any material conflicts of interest as Quicksilver's core business is complementary to Enron, not competitive with Enron. As a personal matter, it is an experience that would be beneficial and would provide valuable personal visibility in our industry. I am scheduled to meet with Glen and others at Quicksilver later this month to further discuss this possibility. Would each of you please let me know after due consideration whether you have any objection to or concern with the position. Please do not hesitate to call me (x67713) if you have any questions or wish to discuss this further. Thanks. Jim Hughes	2
-	Jim, I promised you some contact details. Although I'm a little late with formal notification, as from the beginning of the year I joined Societe Generale on a part-time basis. I'm a Senior International Adviser which means I do pretty much anything I want to turn my hand to. Jay Worenklein, who's the Global Head of Project Finance in New York, is an old friend and we have always said that it would be fun to work together if the opportunity ever arose. In parallel with the SG role, I am continuing with the two roles for the British Government I had previously mentioned to you: as adviser to the Deputy Prime Minister and the Minister of Transport on the use of private finance in the transport sector, and as non-executive Deputy Chairman of Partnerships UK, the new merchant bank cum project developer the Government has formed to take forward its well-known private finance programme. So you can see that I've finally ended up with the sort of portfolio we were discussing last fall. Contact details are as follows: Mobile 44 7802 655 605 At Partnerships UK 44 20 7273 8341 (direct) 44 20 7273 8357 (my personal secretary - Carole James- who can usually be relied upon to know where I am) 44 20 7273 8383 (switch) 44 20 7273 8367 (fax) e-mail: adrian.montague@partnershipsuk.org.uk At Societe Generale 44 20 7676 6821 (direct) 44 20 7676 6881 (Nicola White - who tends to now where I am when I'm at SG, or is a good point of call if Carole is not there) 44 30 7676 6000 (switch) 44 20 7667 2487 (fax) e-mail: as above Since I move between offices a fair amount, if you send an e-mail, it's best to send to both addressed at once.	2
