subject	body	cluster_id
Formation of Enron Management Committee	I am pleased to announce the formation of the Enron Management Committee. The Management Committee comprises our business unit and function leadership and will focus on the key management, strategy, and policy issues facing Enron. The Management Committee will supplant the former Policy Committee and will include the following individuals: Ken Lay - Chairman and CEO, Enron Corp. Ray Bowen - COO, Enron Industrial Markets Michael Brown - COO, Enron Europe Rick Buy - Exec VP & Chief Risk Officer, Enron Corp. Rick Causey - Exec VP & Chief Accounting Officer, Enron Corp. Dave Delainey - Chairman and CEO, Enron Energy Services Jim Derrick - Exec VP & General Counsel, Enron Corp. Janet Dietrich - President, Enron Energy Services Jim Fallon - President & CEO, Enron Broadband Services Andy Fastow - Exec VP & CFO, Enron Corp. Mark Frevert - Chairman & CEO, Enron Wholesale Services Ben Glisan - Managing Director & Treasurer, Enron Corp. Mark Haedicke - Managing Director & General Counsel, Enron Wholesale Services Kevin Hannon - CEO, Enron Global Assets & Services Stan Horton - Chairman & CEO, Enron Transportation Services Jim Hughes - President & COO, Enron Global Assets & Services Steve Kean - Exec. VP & Chief of Staff, Enron Corp. Louise Kitchen - COO, Enron Americas Mark Koenig - Exec VP, Investor Relations, Enron Corp. John Lavorato - President & CEO, Enron Americas Mike McConnell - President & CEO, Enron Global Markets Jeff McMahon - President & CEO, Enron Industrial Markets Jeff Shankman - COO, Enron Global Markets John Sherriff - President & CEO, Enron Europe Greg Whalley - President & COO, Enron Wholesale Services After we convene the Management Committee later this week, I will make a further announcement regarding the Executive Committee.	2
RE: I have moved, but my Phone has not .....	Excellent. Kai will work hard to get you the right deal. That is the advantage of using him instead of a bank. He has multiple lenders available to chose from. Have a good day.	0
RE: Western Frontier update	I spoke with Dale Sanders at Williams today. They seem very positive about the project at this point and have obviously spent a lot of money on right -of-way, regulatory filings, enviornmental and engineering work. I had previously put this project at a very low probablility, especially with the 900 MM/d Kern expansion in 2003. I did not think that they would be able to get Williams Marketing to take a substantial part of this capacity. However, they are making the production company bear the costs of the capacity. Obviously that is the key to Williams being able to have a shot at making this project a reality. Williams is in negotiaitions to fill the other 175,000 mmbtu/d. I have to put that probability at still fairly low, but stranger things have happened, especially if Williams decides to go at risk for some portion of the 540 MM/d. Probably the entire project is still less than 50% but it is obviously something to monitor very closely. If the project gets built it will substantially effect the basis market for CIG and Northwest. Especially on the heels of the Kern River expansion. In addition, the Cheyenne market will definitely strengthen in the back years. Call if you want to discuss or have other ideas about how to monitor these developments.	0
Haina Note	To All: Today we funded the sale of the Haina Note. Enron Caribe Ltd. received approximately $14.5 million. Brian Zatarain, Coralina Rivera, and Darleene McKeever were instrumental in getting the transaction documented, approved, and funded in a very short timeframe.	1
FW: Red Rock Weekly Reports	Steve, Please note that the in-service for Red Rock Sta. 1 and 2 are expected June 1. Sta. 3 is expected June 15. This is very good news for us. Kim.	0
New position - Happy New Year	Hey Steve - I just wanted to touch base with you prior to the new year. I have accepted a position for the next year in Lake Jackson beginning on January 2nd. Hopefully a year is all it will take to get a teaching certificate. I look forward to seeing how the energy job market looks after this time. At least with this position I have a good couple of months off during the summer. Any way, I hope you had a nice Christmas and have a safe new year as well. I'll talk with you later. Christine	1
this will work!	my political career has just begun! get to link and scroll to City of Austin Commission for Women http://malford.ci.austin.tx.us/boards/search.cfm then enter get details and look through the page for my name	1
Organization Announcement	We are pleased to announce that Sally Beck has been named Chief Operating Officer for Enron Net Works. She will join Greg Piper, President and Chief Executive Officer and Mark Pickering, Chief Technology Officer in the Enron Net Works Office of the Chair. In her current role as Managing Director for Enron Net Works, Sally heads up Enron's Global Risk Management Operations. Ms. Beck brings more than 20 years professional experience to Enron, joining the Company in 1992. She graduated from the University of Texas at Austin with a B.B.A. in Marketing and an MBA with a concentration in Finance. Please join us in congratulating Sally on her new role.	2
Services Presentation for Louise Kitchen	Attached is the final presentation on the services business that we presented to Louise today. It went very well and it looks like it is full steam ahead. Thanks to all that helped with the presentation, particularly Utku. Tom.	1
FW: New E-Tag Feature: Potential Adjust List	I am pleased to announce that a new feature is being added to the E-Tag system: the Potential Adjust List (PAL). As you may or may not know, there is currently an "Adjust List" that is issued when TLRs are called. An "Adjust List" is a recommendation from the IDC that describes what transactions should be cut and by how much to achieve needed relief to eliminate a constraint. This Adjust List sent out to Generation and Load Control Areas and Tag Authors for all transactions that are being recommended for curtailment. It is intended to aid in coordination Control Area schedules during curtailment, as well as alert the marketplace of recommendations for their transactions to be curtailed. Under the current process, the Adjust List notice is sent out when the initiating Security Coordinator and all impacted Security Coordinators have agreed to recommend specific curtailments. As such, this recommendation can occur very late, leaving very little time for the market to react (i.e., resource and/or resink their power). The Potential Adjust List feature adds a second, earlier Adjust List that is sent out when the initiating SC requests relief, but prior to the confirmation of all the impacting SCs. This should allow this recommendation to be delivered several minutes sooner than it is today, giving more time for the market to begin searching for alternate economic sources and sinks. When all impacted SCs confirm, the standard Adjust List recommendation is sent out as it is today. It should be recognized that both the Potential Adjust List and the standard Adjust List do not represent actual curtailments - in both cases, they are only recommendations for curtailment. Control Areas may elect to curtail different transactions or amounts than reflected in either Adjust List due to local relief procedures or other business practices. However, both lists should aid in mitigating risk associated with physical transactions and curtailments. Further, empirical evidence seems to indicate that in the majority of cases, the Potential Adjust List, standard Adjust List, and final curtailments will be very close. This change is based a proposal I wrote with the help and support of Jim Eckelkamp (Carolina Power and Light), Mark Scheel (Dynegy), and Patt Terris (Exelon Power Team). If you talk to any of them during the course of daily business, please thank them for their support of this effort. With their assistance in developing the concept, ironing out the technical details, and cultivating NERC support in the various forums, we were able to implement this change very quickly. I expect this change to take place sometime between June 15 and June 28. Attached, please find a message from NERC that describes the feature and how it works. If you would like more detail, please let me know. I currently Chair the group that is responsible for improving E-Tag, and as such, am intimately familiar with tagging and its functions. In the next few weeks, I will be working with Don Baughman and Juan Hernandez to ensure we utilize this feature (and others) to maximize the value of our E-Tagging tools. As indicated above, please feel free to contact me with any questions.	1
EGM Organization Update & Announcement	The first quarter of 2001 was a record quarter for the performance of the businesses under the Enron Global Markets group. We posted a gross margin number of $100 million for the first quarter. This represents a 38% increase in gross margin after a very successful Q1 of 2000. When combined with outstanding results posted in December of 2000, EGM has contributed over $187 million to the Wholesale group in the last 4 months. This was due to tremendous contributions from each business group. In order to keep the momentum going and to facilitate more growth, the following changes and additions have been made within the organization. Crude and Products group Mid-marketing Bill Berkeland has joined the group and is responsible for creating a focused mid-marketing function specifically within this group. Fred Lagrasta is responsible for mid-marketing for Enron Americas and still maintains some responsibility for various contacts and deal flow as well. The purpose of this group is to be very focused in the development of crude and product specific products and services. This group reports to Randy Maffett. Origination In order to manage the increased origination opportunities around the world, the Origination group has been changed in order to insure that the proper focus is placed on these opportunities and to manage its wide scope. Doug Friedman will lead our NGL and Petchem origination efforts reporting to John Nowlan. Joining Doug will be Rick Cantrell recently hired from Union Carbide. The global crude and products origination group has added Randy O'Conner from Red Meteor, who has extensive experience in these markets. Both Randy and Doug Leach's growing fuels origination group will report to Randy Maffett. Trading Lee Jackson will assume the role of U.S. NGL's lead financial trader, supported by Chad South. The petchem and plastic trading businesses have been reorganized under Stuart Bland. Alan Engberg will be responsible for plastics trading in the Americas. Shipping Scott Moncrieff will assume responsibility of our global shipping network related to crude and products. Scott will be charged with expanding all aspects of the shipping portfolio taking advantage of our growing presence in these markets and the successes we have had marketing shipping on line. Weather The weather group under Mark Tawney's direction is expanding its efforts around the world. Europe will have an expanded focus and the London office will focus on new opportunities in Europe. Paul Murray has joined Enron from Castlebridge Partners and will be moving to London to develop and expand the continental opportunities. Ross McIntyre, currently based in London, will report to Paul. Bill Windle has joined the weather group and has responsibility for origination activities for North America. Bill's most recent assignment has been in the EBS organization. The Oslo weather office managed by Thor Lien will have responsibility for Scandinavia weather activities. In addition, employees are being added in the Australia and Japan regions. We are now making markets in 32 cities around the world on EnronOnline. Coal Mark Schroeder has joined the coal group and is responsible for origination activities with generators in the U.S. Mark's most recent assignment was as the head of all regulatory activities for Enron Europe, Japan and Australia. Enron Japan The momentum of power deregulation process has slowed in Japan. The decision has been made to scale back the wholesale power activities. Joe Hirl, President and CEO of Enron Japan, will now report into the EGM organization. Joe will maintain his direct responsibility of the office and will be increasing his focus on the business lines within EGM. All of these products have high growth potential in both the near and long-term and he will coordinate and help implement with all the business lines and their activities. LNG LNG continues to expand with the vision to increase the number of transactions and create a portfolio of assets and contractual access around the world. Jonathan Whitehead has joined the LNG group and has responsibility for all trading and shipping activities. Neal Gerstandt, previously an independent energy consultant, Jared Kaiser, from Enron Americas - East Gas Desk, and Kurt Lindahl, from Enron Global Assets, have also joined the LNG group with responsibilities in the area of origination in the Western Region. Enron Freight Markets EFM has concluded over 2,000 transactions in its first two months. Chris Kravas continues to focus on building the spot trading and mid-market capabilities that will enable it to be the dominant player in its market, and has hired four new traders in the last two weeks. Kellie Metcalf, from EBS, has joined Shawn Cumberland's origination effort, and Deirdre McCaffrey, from Gas Structuring and Mid-Market, has joined Matt Arnold's forward trading group focusing on diesel products. Global Risk Markets David Hoog joined Enron from Ace Insurance in December 2000 and has quickly built a team of people specialized in trading unit contingent power price call options, a hybrid insurance derivative product. Drawing on Ace and Enron resources, this team is based in New York and includes Alex Tartakovski and Larry Marcus from Ace, as well as Joana Bekerman and Tony Chang who recently moved to New York from Houston. Their first transaction closed just 3 months after startup. Brad Blesie will be moving to London in June to establish a base of operation for GRM and expand our insurance derivative activities into the European market place. Among the opportunities he is currently exploring are contingent call options applied to shipping and charter rates, trading insolvent insurance claims, and combining North Sea oil and gas VPP risk with decommissioning insurance. In April this year, EGM established a hedge fund origination effort in New York reporting to Per Sekse and led by Russell Dyk who recently moved to New York from LNG in Houston. Russell is responsible for expanding our commodity trading relationship with hedge funds to include crude oil, products, liquids and other commodities traded by EGM. Joining Russell in this effort is Stephen Plauche, who comes to us from Enron Americas' power trading desk. Financial Trading Elsa Piekielniak has assumed responsibility for Enron's developing agriculture business. Billy Lemmons has changed groups and now runs the Analyst and Associate program for Enron Corp. Please congratulate everyone on their new assignment and we look forward to the continued growth in all the EGM businesses.	2
Asset Marketing	We are pleased to announce the creation of a new group - Asset Marketing - within Enron Americas. The Asset Marketing group will have responsibility for the asset divestment function within Enron Americas and work with Generation Investments on selected portfolio acquisitions as well as managing power origination funding requirements with Treasury. Don Miller will head the Asset Marketing group and will report directly to the Office of the Chair, Enron Americas. Joining Don's group will be Stuart Zisman. Stuart was formerly in ENA Legal, having most recently worked on the sale of ENA's peaker plants with Don. Please join us in congratulating Don and Stuart in their new roles.	2
P&L 10/24/01	Good news! Hub 76,295 Transport 100,182	0
FW: Hello from UT	Hola, If all recipients would please be soooo kind as to respond back with a home mailing address....except for suebob and jojo..got your's already. Well, we I made it safely to UT. We made the drive in about 2 days getting to Provo the 2nd evening and Park City the following morning. Now I am reminded why they always say that it is much safer to fly than to drive cross country. The first day we NARROWLY avoided running out of gas in NOWHERE texas...and I also got a speeding warning from a state trooper. The 2nd day of driving across UT on a two-land highway from Moab to Provo was harsh...it was snowing..i had a deathgrip on the steering wheel while oncoming cars blinded me with their headlights and john slept. Those are just the bad parts but it was well worth the time hanging with John and seeing the country. I've met my 3 roomates, Jimmy, James & Thomas... and they seem normal and to John's delight none of them will be gracing a "Gorgeous Hunks of Park City Utah" calendar anytime soon. It has been snowing almost non-stop since I've been here...and it seems that everyone is off to ski or board here in town. I'm trying my best to hold off until the end of the week when all of my skiing and boarding activities will be free. I am scheduled to start this thurs at the bakery. I'm considering picking up another part time job just to keep things interesting, but I'm going to see how things go with a 40hr schedule first. I hope everyone is doing well. I just wanted to say hello and most importantly get everyones home address. So take care all and I'll be in touch. Sno-mo	0
Houston Endowment, Corporate Support and TFA-Colorado	Gentleman, Thanks for your assistance and support at the recent TFA board meeting. In the good news department we have several items.... 1. Houston Endowment commited $200,000 payable in two installments (June 2001 and June 2002). Thanks to Jack Trotter for asisting with this grant request. 2. Letters are going out to corporate leaders following the recent breakfast. We thank Ken Lay, John Duncan, Scott Yeager and Jack Clark for their assistance on the letter. We especially thank John Duncan and Jack Trotter for their assistance with suggested contribution amounts. Contributions will go to support TFA activities in Houston and beyond. 3. I was in Colorado last week. We have successfully negotiated the support of the Jared Polis Foundation for Technology For All-Colorado. Jared Polis has made a three year commitment totaling approximately $750,000 to support TFA-Colorado as a project o the Foundation. Mr. Polis is a 29 year old entrepreneur who sold the online business of Blue Mountain cards to Hallmark for around $800 million. He is very interested in education and technology issues and has essentially agreed to fund the work of TFA-Colorado for at least three years as additional community support is developed. We will "co-brand" the web presence of TFA-Colorado with the Foundation. THANKS TO EACH OF YOU....	1
May Blackmore Report	I am pleased to send you the May report - has a lot of positive news and progress despite the challenges in the overall market. Look forward to seeing you at the next Board meeting. Regards, Peter	2
Great Job!	You guys did a terrific job on the Frontline program last night	0
United Travel Update - IAM Contract Agreement	Dear Mr Motley: I'm writing to tell you that our negotiations with the International Association of Machinists (IAM) District 141M have produced a tentative agreement on a contract, ensuring no disruption of service to United customers. This has been a difficult time, and I want to thank you for your understanding and continued support. IAM District 141M will forward the details of the tentative agreement to its membership for a vote within the next two weeks. This decision allows us to continue focusing on serving you, and I hope it renews your confidence in planning your travel with United. We look forward to seeing you on board.	1
RE: SoCalGas Response to TW Protest of AL 2837-A	Glen, I had a conversation with Pat Davidson (SoCal) yesterday. Things have been going smoothly, because SoCal has not been calling any OFO days. She felt like we would not have an issue until spring and at that time, there is an expectation that SoCal could be calling more OFOs. We agreed to continue talking, but that does not resolve the issue completely. Thanks. Lynn -----Original Message----- From: Hass, Glen Sent: Monday, December 03, 2001 9:44 AM To: Donoho, Lindy; Blair, Lynn; Harris, Steven; Watson, Kimberly; Kilmer III, Robert; Lokey, Teb; Kowalke, Terry; Schoolcraft, Darrell; Lindberg, Lorraine; Lohman, TK; Rapp, Bill Subject: FW: SoCalGas Response to TW Protest of AL 2837-A FYI--Attached below is a summary of the protests and comments the CPUC received in response to SoCalGas' Advice Letter filing on receipt point operating procedures. Lynn, Are they still working with us to resolve the OFO/Intraday 2 issue? gh -----Original Message----- From: "Dan Douglass" <douglass@energyattorney.com>@ENRON Sent: Friday, November 30, 2001 5:59 PM To: Rapp, Bill; Hass, Glen; Gregg Klatt Subject: SoCalGas Response to TW Protest of AL 2837-A Attached is the SoCalGas response of our mild protest to their advice letter 2837-A. The relevant language is on page 5 of their letter and has been highlighted for your convenience. In part, they state that: "These types of reductions are no different from today's practice of allowing customers to reduce nominations in the fourth scheduling cycle. The flaw is not in SoCalGas new procedures. SoCalGas provides customers with notice of an upcoming OFO two hours prior to scheduling cycle closing times. Within those two hours, customers can make changes to their nominations and still meet the scheduling timeline as defined by GISB standards. Even if SoCalGas cuts nominations in cycle four because customer reductions don't reduce deliveries enough to avoid operational problems, changes in cycle 4 are within GISB standards. Transwestern is supposed to be complying with those GISB standards and seems to state that it is unable to do so." They go on to state a willingness to work with us on the issue. There is no procedural option for us to respond to their response. At this point, our option is to meet with Energy Division staff to discuss the issue further, should we feel the need to do so. Have a good weekend! Dan Law Offices of Daniel W. Douglass 5959 Topanga Canyon Blvd. Suite 244 Woodland Hills, CA 91367 Tel: (818) 596-2201 Fax: (818) 346-6502douglass@energyattorney.com << File: mailto:douglass@energyattorney.com >> - 2837ARES.DOC << File: 2837ARES.DOC >>	1
RE: iPayit	That was FAST! Groovy! :-) -----Original Message----- From: Rapp, Bill Sent: Thursday, November 15, 2001 3:36 PM To: LaGesse, Denise Subject: RE: iPayit Denise, Thank you very much. I just got off the phone with someone from technical services and I think (knock on wood) that the problem is solved. Thanks again! -----Original Message----- From: LaGesse, Denise Sent: Thursday, November 15, 2001 2:16 PM To: Rapp, Bill Subject: iPayit I logged on as you from my computer and approved those 3 invoices for you. I'll check with tech support on why you can't access it from your computer.	2
