subject	body	cluster_id
FW: WorldCom Calling Card	Pls confirm that you have received your new WCom calling card. Thank you.	1
You still there?	Mike - you still working? Let me know what is up with you through all of the Enron BK fallout.........pbw	1
phil	do you happen to know fun phils email address?	2
Just Curious	Hey Mike, Just curious if you all have given any thought to posting a MEC Market. You have NSP and AECI and we would sure be interested in supporting a MEC market. How the things going for you, I am sure right now it must be a bit tense In lieu of everything that is taking place with Enron. I wish you well and have a Happy Thanksgiving.	1
Enron Metals North America Voluntary Severance	Michele, Per our telecon, the timeline to roll out the VR for Metals North America has been escalated to THURSDAY, October 18th which only leaves us tomorrow to try and tie up loose ends. Attached 'NA Metals Analysis' spreadsheet will give you all the demographics of our population, include, ethnicity, gender, age, etc. please note the 'standard' tabe includes everyone on Enron standard at-will employment letters. The second tab 'agreement' has all our people on exec agreements. The 'BU Briefing to Staff' will give you a good general overview of the program that was rolled out in EEL, I've red-lined the document to tweak it to the US side. The employee info packet will include 'Enron Metals Change Program' document, 'VR Application' and 'FAQS.' Again I've red-lined these EEL originated documents to fit the US side. There are still some oustanding items I need to confirm with Comp & Ben. My immediate questions are: Will our current severance policy allow us to provide an enhanced voluntary program? We want to offer it to all employees. Can we do this and still reserve the right to reject applications? If we do reject applications under the Voluntary Program will we be prevented from terminating the employee under the compulsory program? Do we need to make any special consideration for employees on maternity leave ( I have three!!). Please call me when you've had reviewed these items so we can determine how quickly we can move forward. Thanks Cathy	1
follow-up	Michelle- I hope that this message finds you well and that you are having a great week. I spoke with Mark Broadfoot this afternoon and he suggested I try to reach you through e-mail. I just would like to inquire with you to see if you have any feedback regarding the PWD sample that Darlene Donlan forwarded back to you last week. If you could please let us know where that stands, or if you have any feedback and/or questions it would be greatly appreciated. Thanks and have a great evening.	0
RE: Boeing	Send 'em on... -----Original Message----- From: Cash, Michelle Sent: Monday, October 29, 2001 3:50 PM To: Seleznov, Ryan Subject: RE: Boeing yes. I have contacts there, if you want. Michelle -----Original Message----- From: Seleznov, Ryan Sent: Monday, October 29, 2001 3:49 PM To: Cash, Michelle Subject: Boeing Michelle, do you believe they would be a good company to contact regarding ER team? Ryan	1
FW: Qtrly EEO/AAP notice	Michelle, Please let me know what your changes will be to the memo and if you would like to meet to discuss the reports. Thanks! Regards, Sandra	2
FW: Due Diligence List	Any comments to the Employment related section? Ron is developing a form due diligence list. Julia	1
Enron Capital & Trade Resources International Corp.	Michelle, Long time no see - hope you're doing well despite the difficult times we're in. I'd wish to consult your employment law expertise. Staff in Oslo and Stockholm are employed by the captioned company, incorporated in Delaware. The question has arisen what guarantee, if any, there is for salaries and other employment benefit under a US bankruptcy or Chap. 11. Perhaps you have a memo or something to send over. Thanks. Martin	1
bankruptcy effects on charges of discrimination	Please let me know what the bankruptcy folks say in terms of whether the stay extends to regulatory/investigatory proceedings like the EEOC. Even if the stay applies to the EEOC proceedings, we may need to continue investigating or be unable to claim that we conducted prompt and thorough investigation of claims.	2
PBGC Reportable Event	Michelle, We are working on completing the reportable events form for the PBGC and supplying the requested data. Included in the data request are: (1) copy of bankruptcy petition or similar documentation (2) docket sheet or other list of documents file Please provide copies or direct me to the person who can provide copies of the above data requests. Thanks Chris	0
Pension Questions	Michelle and Cynthia, I really need to track down each and every pension plan and multiemployer pension plan to which the company contributes or for which the company may have liability. Can either of you direct me to the appropriate person(s) who would be able to provide such information? Thanks, Drew Clark	2
ECTRIC Team	Eric John Sherriff has advised us of the proposal for you to lead a team to close out and maximise the value of the ECTRIC assets. Michelle Cash is the employment lawyer who is best placed to provide you with the agreements you require to obtain and keep the team you require. Please could you send the list of individuals you need on the team to David Oxley and Michelle Cash who will advise further. Kind regards, Marcus	1
FW: Frank Stabler - Request to Extend Term Date from 12/01/01 to	Michelle / David: Frank Stabler called to determine the status of his separation agreement amendment. Bernadette Etienne, in Mary Joyce's Office, called to say that she received the amendment signed by Frank in their office and wanted to know what to do with it. Should this document go to the Cash Mgmt Committee for authorization to execute? Shelly X57962	0
: Dave Parquet	Michelle / Robert, What is the status of Dave Parquet's Employment Agreement? Can either of you give me an update?	1
Policy issues for the bankrupt estate	Kalen,. per your discussion about getting these issues to management committee, below are some of the HR Policy changes to consider implementing prior to year end. Clarification - what revisions, if any, should apply to the non-filed entities? Vacation - change the accrual rate, as planned FMLA / Sick Leave - FMLA leave to run concurrent with Enron's sick leave program when appropriate. Educational Assistance: suspend tuition reimbursements. Leave of absence - reduce or amend paid leave. Leaves include: Personal leave (eliminate Mgmt. discretion) Funeral /bereavement leave (should we establish a policy cap of 3 days) Paternity / adoption / pay to parent / father - (40 hours paid outside of Enron sick leave) Jury - Witness duty - (pay to the extent required by law) Military leave - (reduce or eliminate the salary bridge paid- difference between Enron base and military pay)	1
expenses for former employees	Are former employees limited to the $4500, or do they participate in the reimbursement up to $15k that I've been hearing about?	0
FW: Message Received in EMA	Can you forward me a list of the bankruptcy companies? Thanks.	1
FW: Enron Matching Gifts	Diane, I'm assuming that these are not being paid. Michelle, do you have any idea if she could get out of her commitment. I'm assuming that she really isn't liable for the $1,000 match.	1
RE: Enron Matching Gifts	Kalen - It is my understanding that the matching funds were handled by Community Relations which reported through Cindy Olson. Cindy - Can you provide any information on this question. Thanks, Diane	2
Release from contract	Michelle, I hope you had a good Christmas. I would appreciate if you could please let me know where you stand with the agreement to release both me and Enron from the obligations contained in my employment contract. I have a firm offer for employment that is running out of time. I would greatly appreciate your help in resolving this issue as soon as possible. I look forward to receiving a draft of the agreement by email as per our understanding. Thank you for your attention.	1
-	Would you mind checking into something for me? One of our lawyers was called by someone from Industrial Markets who was laid off. He indicated that he had an employment contract that has a six month non-compete for involuntary termination. He said that he called HR to get a waiver of the non-compete so that he could pursue new employment and was told that no waiver would be granted. Is that our policy or are these issues being addressed on a case by case basis? I find it hard to believe that we would even think about enforcing a non-compete for someone we've laid off, so why not grant the waiver? If this is not the policy, we need to get this straightened out.	1
FMLA Policy	As you know, Sarah is on her honeymoon now, so I am trying to tie up all loose ends with regard to the FMLA and Sick Leave Policy. I would appreciate it if you would read the following documents and let me know if we have the "go ahead" to proceed. We are beginning to work on a very tight deadline here since we need to give the appropriate notice to all employees. After reading the FMLA policy, do you think that we need to have links that explain ADA and Workers Comp? If you have any questions, please don't hesitate to let me know.	2
Severance	Can we use credited service date for sev calc? I have a person who was hired in 1997, left in 1999 and was rehired in April 2001. The system is using a 1998 service date for severance. I calculated in on the 2001 re hire date.	1
RE: Pulp and printing & writing presentation - Facts & Figures	Monika: Thanks for your excellent analysis on the pulp market. One question I had was why Metsa-Botnia (2.5 million tons NBSK per year) was not included? Metsa-Botnia is a joint venture between M-Real (formerly Metsa Serla) and UPM-Kymmene. Have these volumes been included under UPM and M-Real? Let me know when you get a chance. thanks	0
Important Information Needed!!!!!!	We are in need of the following information: Emergency Contact Name: Emergency Contact Phone: Please update this information by going through eHRonline or email me with the information. Your cooperation is appreciated !	2
RISI Comparison	I am looking to see if anyone has done a comparison between RISI price forecasts for any commodity versus RISI actual price. Dave had mentioned that maybe someone had already done this. Please let me know,	2
Emergency Contact Information Needed!!!!!!!!!	We are in need of the following information: Emergency Contact Name: Emergency Contact Phone: Please update this information by going through eHRonline or email Gwendolyn Gray with the information. Your cooperation is appreciated !	2
Exchange Rates	Any chance we could look at the US$/Euro rates in addition to the US$/C$ rates to see whether there's a strong correllation for use in the forecasting model? Thanks.	1
FW: Consumers 2/01	Martin: I do not have any info. backup the pricing on these deal back to Feb of this year. I'm going to ask Stephanie to look into it but, if you do please let her know. Thanks, Mark	2
-	Martin - What do I need to do to get set up to trade paper with you? I assume we just need to sign an ISDA ? please call and let me know Bruce Potter 317.231.6864	2
-	Craig - I need the date and location of your drug test.. Pls e:mail me asap Thanks,Karen.	2
FW: TDSP Service Agreement	Dear Ms. Roffmann: I am with Enron Power Marketing Inc. and have been working on our effort to test as an LSE in flight 1001. I have a couple of questions regarding transmission services and hope that you can answer them or direct me to the person who can. We need to speak with someone who can assist us in getting a service agreement set up for the Reliant control area in order for us to operate as a Load Serving Entity. If someone can explain or provide information regarding the basic service package or other available packages that would be extremely helpful. Any help you can offer would be greatly appreciated.	2
EPE Cuts - 10/12	Did anyone take care of Powerex cuts on Friday? I've entered a sale to Powerex to bookout for two hours in which they cut a preschedule (deal 795777/tag 16EV) and were unable to resupply the entire 25 mw. Sale is for HE 13 - 13 mw @ $46, and HE 21 - 6 mw @ $31. Prices are EPE's incremental costs for those hours, used per Steve at El Paso. If any of you have more information about these cuts and how they should have been handled, please let me know. FYI - Cuts were not handled correctly if Real Time Position Manager is not flat when you leave.	2
PLEASE RESPOND: Training Opportunity--Tricks of the Trade (Thursday, November 8, 2001)	Hello again! You have been identified by your manager (and Amy FitzPatrick) as a target participant for the Trick of the Trade/Energy Math course. Please see below for course information and confirm your attendance by no later than Wednesday, October 31st, 2001. If you have any questions, please let me know!	2
Mid-Year 2001 Performance Feedback	DERRICK JR., JAMES V, You have been selected to participate in the Mid Year 2001 Performance Management process. Your feedback plays an important role in the process, and your participation is critical to the success of Enron's Performance Management goals. To complete a request for feedback, access PEP at http://pep.enron.com and select Complete Feedback from the Main Menu. You may begin providing feedback immediately and are requested to have all feedback forms completed by Friday, May 25, 2001. If you have any questions regarding PEP or your responsibility in the process, please contact the PEP Help Desk at: Houston: 1.713.853.4777, Option 4 or email: perfmgmt@enron.com London: 44.207.783.4040, Option 4 or email: pep.enquiries@enron.com Thank you for your participation in this important process. The following is a CUMULATIVE list of employee feedback requests with a status of "OPEN." Once you have submitted or declined an employee's request for feedback, their name will no longer appear on this list. NOTE: YOU WILL RECEIVE THIS MESSAGE EACH TIME YOU ARE SELECTED AS A REVIEWER. Employee Name: CARTER, REBECCA LABANOWSKI, SHARP, VICTORIA	1
Availability	JVD, can you let me know when you are ready to talk to me about the Joanne Gregory thing with Winston and Strawn?	2
Arbitrators for Blockbuster Arbitration	We have been given a new list of potential arbitrators. Please take a minute and let me know if any of these represent us, and the general level of representation. Thank you again for your help. If you want to leave me a voicemail, my telephone number is (713) 646-6412. 1. William Frank Carroll--Donohoe, Jameson & Carroll 2. James E. Coleman Jr.--Carrington, Coleman, Sloman & Blumenthal 3. Randall Duke--Johnson & McElroy 4. Edward Fiorito--Consultant 5. Eric F. Hale, Jr.--formerly with Carrington, Coleman; now self-employed 6. Herbert J. Hammond--Thompson & Knight 7. Orrin Harrison--V&E 8. Brian J. Hurst--Baker & McKenzie 9. C. Michael Moore--Locke Liddell 10. Robert C. Prather, Sr.--Jordan, Dunlap, Prather & Harris, L.L.P. No need to respond as to V&E or Locke Liddell, except as to information about the individuals. Steve et al., Baker & McKenzie does represent Enron on several matters of which I am aware, but to my knowledge it is not one of our top 10 firms in billings.	2
Institute for Law and Technology	Hi Jim, In response to your voice mail message, please know that you remain our first choice to chair the new Institute. As long as you are still eager and able to lead it, we want you. Please let me know if the e-memo below needs to be revised in any way. Upon your approval, I'll shoot it right out. Thanks. TO: The Executive Committee of the Institute for Law and Technology FROM: James V. Derrick, Jr., Chair RE: Our Inaugural Meeting According to our e-poll, the best date for our first meeting is Wednesday, January 23, 2002. So it shall be. Please mark your calendars and make your plans now to join us at 12:00 p.m. on the 23rd at the Tower Club on the 48th floor of Thanksgiving Tower in downtown Dallas, 1601 Elm Street. We will begin over lunch, work through the afternoon planning the organization and first activities of the Institute, and conclude with drinks and an early dinner at the Tower Club. Please confirm your plans to attend the meeting and the dinner to David Winn at dwinn@swlegal.org <mailto:dwinn@swlegal.org> . An agenda and a draft organizational plan will be sent to you in advance of the meeting. In the meantime, as ever, please feel free to call or email me anytime with your thoughts on this important new global forum. I look forward to seeing you in Dallas on the 23rd and to building this newest Institute of the Center for American and International Law.	1
September 2001 FERC California Report - Preliminary Ready for Review	Here are the preliminary reports ready for your review. I have done a thorough analysis on Items 2 and 3 and feel very confident with the data. I will be finalizing my review of contract volume data in Item 1 no later than tomorrow and will advise if any changes are necessary. TK - Please update the daily rates for contract 27495 (Astra) and verify the rates in blue. Additionally, please verify that the discounted IT rates for contract 20248 and 22136 are correct as billed (it doesn't appear that these discounts appeared in the daily transactional report postings). I need all updates/comments no later than COB Monday, 10/29/01.	0
FW: Bus Applications Meeting Follow Up	Lindy, Here is the original memo we discussed earlier. Please provide any information that you may have. Your cooperation is greatly appreciated. Thanks, lachandra.fenceroy@enron.com 713.853.3884 877.498.3401 Pager -----Original Message----- From: Bisbee, Joanne Sent: Wednesday, September 26, 2001 7:50 AM To: Fenceroy, LaChandra Subject: FW: Bus Applications Meeting Follow Up Lachandra, Please get with David Duff today and see what this is about. Who are our TW accounting business users? -----Original Message----- From: Koh, Wendy Sent: Tuesday, September 25, 2001 2:41 PM To: Bisbee, Joanne Subject: Bus Applications Meeting Follow Up Lisa brought up a TW change effective Nov 1. It involves eliminating a turnback surcharge. I have no other information, but you might check with the business folks for any system changes required. Wendy	1
FW: Operating agreements	Lindy, Could you tell me how many of the operating agreements below you have a copy of? Tiny is trying to complete his files. Thanks, Kim. -----Original Message----- From: Roensch, David Sent: Thursday, February 07, 2002 7:01 PM To: Watson, Kimberly Subject: RE: Operating agreements Kim, I wasn't waiting on you. You had provided me with a contact last year I just misplaced my note. (Feel like we are running a race with the Devil lately and he is gaining ground.. Ha! It's so busy....) The Operating Agreements I know that are no longer on file include: (This is really kind of embarassing as I know these Operating Agreements were on file when I was on the Bloomfield Team. Someone must have discarded them...) Anyhow, Amaco LaPlata Northwest Pipeline - La Plata WFS - LaPlata Red Cedar both La Plata and Ignacio WFS LaMaquina WFS Milagro - Blanco Hub TransColorado - Blanco Hub Burlington - Blanco Hub NTUA - San Juan Citizens if there have been updates in the last five years. - Flagstaff and Kingman TBS's I hope this is not to much trouble... My priority for now lies with Amaco/La Plata... No hurry on any of the others.. Thank you so much ---------------------- Forwarded by David Roensch/ET&S/Enron on 02/07/2002 05:53 PM --------------------------- From: Kimberly Watson/ENRON@enronXgate on 02/04/2002 07:55 AM CST To: David Roensch/ET&S/Enron@ENRON cc: Subject: RE: Operating agreements Tiny, Thank you so much for the reminder, sometimes I think my brain has slipped away. Do you need all of the San Juan and West of Thoreau contracts? If you know you have some of them, which ones do you have, I'll send you the rest. My apologies, Kim. -----Original Message----- From: Roensch, David Sent: Saturday, February 02, 2002 12:31 PM To: Watson, Kimberly Subject: Operating agreements Kim, last year you provided me with a name/contact in your group that could help me obtain Operating Agreements for customers/interconnects in our area which we curretnly do not have on file. Unfortunately, I procrastinated with all the happenings towards the end of the year and lost the name.. Could you please send me the name so that I can proceed with the plans of setting up a Regional master file with those agreements.. Thanks	1
Information for our Meeting	Lindy - While it is fresh on my mind -- it would be great if you could capture the following information before our meeting: - the amount of Unamoritized Accrued Earnings related to Gallup (remember - Andersen wouldn't let us take it as MTM) [Centilli should have access to this information] - the amount of the rebates you have been receiving from ECS for Gallup related to the demand charge miss [Centilli should have access to this information] - copies of all the ECS agreements (Bisti, Bloomfield, Gallup, WT1, Hubbard) - Hubbard run hours and payments ECS - last 3 years [you can ask John Sturn for this] - Projected amount of TW fuel over collection 2002 - A list of the other ETS electric compressors [John Sturn] - Total non-compressor related electric charges ETS paid in 2000 and 2001 - someone in Wasaff's group should have this / or someone in Omaha. See you then. Dave	2
FW: Tw	Can either of you help me here? -----Original Message----- From: Hayslett, Rod Sent: Sat 11/24/2001 11:33 AM To: Geaccone, Tracy Cc: Taylor, Sarah; Desai, Jayshree Subject: Tw There are files that back up the revenue projections that Steve Kleb gave me hard copies of for 2001 and 2002. Can I get electronic copies of these, they have volumes and margins and appear to back up the revenue projections. 2002 File looks like s\marketing\twfinmkt_anly\Tw\twfin\2001\misc\[plan_forecast_design.xls]\summary. 2001 file looks like s\marketing\twfinmkt_anly\tw\twfin\2001\forecast-CE\[ce 3-2001.xls]model _source_data. If the same exists for 2000 can we get it as well. I would like as soon as possible and you can email to the cc addresses as well.	0
-	Could you please let me know if there are any procedures that any UBS people are still running that should be run by the estate team? If there are, please send me a list of them so we can have someone take them over. Thanks, Stephanie	0
RE: Peoples	Do you have quantities at price or is it all calculations? Thanx, Laura -----Original Message----- From: Giron, Darron C. Sent: Monday, February 04, 2002 4:06 PM To: Luce, Laura Subject: Peoples This is the last file I sent Dierdre. It has four tabs. One summarizes the monthly cash flow into two columns (Peoples Deal and PERC Deal). The monthly values are PV'd. The PERC tab is the Lagrasta deals. The Peoples Deal is broken into two tabs (Baseload Sale and Transport). The baseload sale includes all of the price fixing deals as well as the index -$.03 deal. Transport is just that. I hope this helps. DG << File: PeoplesSummary.xls >>	1
RE: Additional deals to move to Bankruptcy Books - Phy Gas	can you tell me why EH6453.2 is not on the list? We are moving EH6453.5, in the comments it says it is an unwind of leg 2. Counterparty is Boston Gas. Thanks. PL -----Original Message----- From: Balfour-Flanagan, Cyndie Sent: Wednesday, January 30, 2002 4:31 PM To: Diamond, Russell; Giron, Darron C.; Gossett, Jeffrey C.; Hall, Bob M; Hodge, Jeffrey T.; Love, Phillip M.; Palmer, B. Scott; Richardson, Stacey; Theriot, Kim S. Subject: Additional deals to move to Bankruptcy Books - Phy Gas Attached are some additional phy gas deals that need to be moved over to the bankruptcy books. Thank you! Cyndie << File: Deal legs to Add to Tagg list (still in books).xls >>	1
New Corp Login	Question for NetCo employees: The new corp id's xfer to UBS is being considered for this Sunday. Hence, no start menu access to estate. You will still have access to NT estate drive data to copy. Does anyone have the need to retain a estate id for support estate application during the last week? Exceptions have to be authorized. Wanted to get a preliminary need analysis... This was sent by an IT manager, let me know your thoughts... O	0
EOL products	Now that we know which traders will be moving over, or we should, we need to make a second pass at the EOL product list. Can you confirm with your desk heads that the list of names we have is correct, and then update the product mappings by tomorrow afternoon? O:\erms\erms_adm\netco\controls\Trader-Book template (US Gas)_EOL new books.xls Thanks KK	0
