subject	body	cluster_id
RE: Additional Book to Move	Darron, Please confirm the following: 1. I can't find the book ENA-WT-SOCAL in Estate database (please provide the CP ID) 2. Move active Financial Deals from NG-PRICE (CP ID 11360) 3. Move active Financial Deals from NG-PR-OPT (CP ID 92649) 4. Commodity code: NG or NGGJ? 5. Please provide the cutoff date to determine active deals (e.g. instr_end_dt > ? 1-jan-2002?) 6. Use ENA CP ID 1305 as the other side counterparty? If I can have all the answers soon then I think the deals move can be completed around 3:00p.m. Thanks, Cecilia x53362 -----Original Message----- From: Giron, Darron C. Sent: Monday, January 28, 2002 8:55 AM To: Cheung, Cecilia Cc: Love, Phillip M. Subject: Additional Book to Move Cecilia, In addition to moving the deals detailed in my previous email, please move only financial deals with the same counterparties from NG-PR-OPT to ENA-WT-SOCAL. I realize it's a big list, but how long will the entire process take? If you have any questions, please let me know. Thanks. DG -----Original Message----- From: Giron, Darron C. Sent: Friday, January 25, 2002 3:56 PM To: Cheung, Cecilia Cc: Love, Phillip M. Subject: More Counterparties Attached is a long list of counterparty names to move from NG-PRICE into ENA-WT-SOCAL. Please move only financial deals only. Please let me know when this is complete. Thanks. DG << File: PositiveMTMCounterparties.xls >>	0
trader matrix	Do you guys know which books each of your people will be doing? There is a column for that in the trader matrix under the controls folder. Ramesh will be loading our information into risktrac for us once we have all of the information, book admin id is one of the fields he needs. When you have decided can you please input that into the trader matrix and I'll then forward everything to Ramesh. Thanks Kam	2
-	Darren, Here is the bottom line on the transaction. Upside: Term: 12 month fix price @ 50,000 day Estimated term value: ~$60M Split profits 50/50 Downside: Buyer credit: BB (on negative credit watch now) Let me know if you are interested in this one.	1
Confirmation of Forward Purchase	As we discussed, I never received a confirmation of the May, June and July forward gas purchase (1,000 per day at Ventura at $2.895/mmBtu). This purchase was made through Brian Frihart. I need to know if Enron plans to stand behind this purchase. Without confirmation, I will assume that the deal is no longer valid.	1
ENA Support of GRE Gas Purchase and Risk Management Decisions	Periodically, I need some help in data gathering for analysis. Is it possible for someone at Enron to occasionally provide the gas market data that I need? I would like to look at the following data for 1999 and 2000 prior to our November 13 meeting. * Daily Henry Hub Prices * Daily Ventura Prices * Monthly Index Henry Hub (Inside FERC Gas Market Report) * Monthly Index Ventura (Inside FERC Gas Market Report) Please give me a call.	0
Fixed Forward Contract Purchase - Ventura	We are looking to lock in some gas for May, June and July of 2002. Would you check with the traders on the price qoutes for 1,000 per day at Ventura. May 1,000 per day June 1,000 per day July 1,000 per day Please call me at 763-241-2490	1
RE:	Thanks John. How do I become a part of ENA? -----Original Message----- From: Griffith, John Sent: Wednesday, November 14, 2001 11:53 AM To: Khanna, Sanjeev Cc: Vu, Steven; Nguyen, Michael; Tawney, Mark; Zipper, Andy Subject: A broker just sent me this today. I am going to talk to him to get the details after trading. Thought you would like to know. Thanks. John "Here is the announcement: Reliant Energy Weather Risk Management Group has developed Weather-sensitive Gas Load Indices ("WGLI"), indices that measure national or regional residential and commercial gas consumption during the heating season. We believe the indices will provide valuable information for gas traders as well as other market participants. We plan to make a swap market in the indices in the near future. We hope the WGLI swaps will become a new financial tool to help you or your clients to better manage their risks associated with the fluctuation of gas demand."	1
RE: Employees	Here is the list: Shannon Groenewold - El Paso, Transwestern Justin Fernandez - El Paso, Transwestern Daniel Lisk - Socal John O'Connor - Socal Suzanne Christiansen - PG&E, PGT Corey Wilkes - PGT and training on PG&E Ben Schoene - PG&E and training on PGT Stacey Brewer - Northwest Pipeline, Kern, Questar, Williams Opal Walt Spiegelhauer - Northwest Pipeline, Kern, Questar, Williams Opal Shelly Mendel - CIG, WIC, Trailblazer, Public Service Co. Jackie Adams - CIG, WIC, Trailblazer, Public Service Co. -----Original Message----- From: Grigsby, Mike Sent: Wednesday, November 14, 2001 5:14 PM To: Sullivan, Patti Subject: Employees Will you please send me a complete list of all of our west schedulers and their pipe responsibilities? I want to set up a mentor program with the traders. Talk about it later. Thanks, Mike	1
FW: Storage Sample	Hi Mike, just wanted to show you what I sent Keith last week. I'm working on getting more info and also working on cut codes with Chris Hyde and Matt pena (UNIFY/IT). Thank you.	0
Media Questions	We have received the following questions from the Wall Street Journal and Bloomberg. We will not necessarily respond, but would you please provide answers and let me know your view whether or not we should respond to the following: Have you had any further contact from Fitch? (DeSpain) Has there been a change in status to the SEC inquiry? Which office is handling - Fort Worth? (Rogers) Have you been contacted by the Federal Reserve or any other agency conducting an investigation? (Rogers) Have you been in contact with or retained bankruptcy counsel? (Haedicke) Have you been contacted about a takeover - Royal Dutch, GE? Have you retained Goldman Sachs to advise you on credit rating, financing issues or to find a strategic partner? Will they receive an equity stake to help Enron get out of its current situation? (Bowen) These reporters are on deadline tonight, so let me know as soon as possible. Thank you. Karen x39757	1
Crescendo Threatened Litigation/ Colorado Counsel	As you know, we received a letter from Rocky Mountain Helium ("RMH") threatening litigation in connection with Enron's investment in Crescendo. We believe that if RMH files suit, it will be in Federal Court in Denver. Do you guys have a firm that you have used in Colorado (preferably Denver) that you would like me to call about this case? Thanks in advance.	1
RE: ISDA North American Energy and Developing Products Committee	Stacy: It occurred to me that members of the North American Energy and Developing Products Committee might be interested in participating in a discussion about one of the changes to the Ontario Market Rules that is currently being considered by the Board of Directors of the IMO (the Independent Electricity Market Operator in Ontario). The Ontario Market Rules have, to date, been designed such that generators of electricity will receive a 5 minute price (EMP or energy market price) from the IMO, and consumers of electricity receive an hourly price (the HOEP or hourly Ontario energy price). The HOEP was calculated as the weighted average of the EMP for an hour. For a variety of reasons, the IMO has now decided to change the way that the HOEP is calculated, such that it will be the straight average of the EMP's for the hour. Customers have already entered into swaps, fixing the price at which they will purchase electricity, in which they pay a fixed price and receive the HOEP in return. Therefore, if the quantum of the HOEP is now different than is was based under the formula in effect when the contract was entered into, the economics of the deal have changed. It's not clear at this time how material this change in calculation will be. Will it make a $0.05 difference to the HOEP, or a $3.00 difference to the HOEP? In other words, is it a Material Change in Formula? Let me know if you think this might be of interest to the members. Meg	2
Member Applications	The following 12 applications will go for approval at the next executive committee meeting on Thursday, November 1. Please let me know if you know Kommunalbanken AS or KommunKredit. Thank you. Mary Primary Regional 1. Hamburger Sparkasse - German bank Associate Broker 2. Tradition (North America), Inc. - broker Associate 3. LIFFE - exchange 4. Arendt & Medernach - Luxembourg law firm 5. Wistrand Advokatbyra - Swedish law firm Associate Emerging 6. Deacons - Hong Kong law firm Subscriber 7. Kommunalbanken AS - local gov't (Norway) funding agency 8. KommunKredit - provides loans to the Danish local authorities and Danish semi-municipal institutions 9. CDC IXIS Asset Management - (its parent CDC IXIS Capital Markets is a Primary member) 10. DKR Capital Inc. - Investment management firm. (Formerly known as AIG International Asset Management Inc. DKR is no longer an affiliate of AIG.) 11. Bank of England - Central bank 12. Swiss National Bank - Central bank	1
FW: ISDA - resending email...	Amita Can you please let me know whether anyone involved in EOL would be willing to speak at this ISDA conf on 4 December. J Marsh and I are both doing slots already. Mark Haedicke is on the board of ISDA (as you probably know) and is keen for Enron to oblige. Fiona - do you have any views? Paul	1
RE:	David, What is Enron's relationship with the recruiting firm Hiedrick and Struggles? The are calling around here. Jeff	1
Bankruptcies	Will Leasa Mellencamp or the bankruptcy committee now be handling EES bankruptcies or just advising on the process?	1
Re: Fw: (FROM DOUG WALTER) Applications and Affidavits	I am still hearing rumors about an involuntary by Haynes and Boone. Has anyone else heard anything? Don't they have some conflicts here? Hugh	1
EcoElecrica / Possible Mirant Offset	All: I understand that Mirant, the buyer in our EcoElectrica deal, may have some outstanding trading exposure with Enron and/or its affiliates. The issue has been raised of whether Mirant may attempt to offset amounts to which Mirant believes it is entitled against the $266 million purchase price that Mirant is obligated to pay an Enron affiliate in the EcoElectrica deal. I understand that Enron has netting agreements in place with certain counterparties which may permit such offsets. Which lawyer in the Enron trading world can help me determine what, if any, contractual arrangements are in place with Mirant that bear on this important issue? Pls let me know.	1
Board Meeting	There is a board meeting scheduled for Tuesday, December 11 at 8:00 a.m. in the Glass Room. Would you please let me know if you will not be attending. Thank you.	2
Proposed Cancellation of 14 LLC's - Expedited Response Request needed	The following limited liability companies are being considered for dissolution this week. Please let me know by 1:00 p.m. on Wednesday, December 12, 2001 if there is any reason not to dissolve these limited liability companies. If I receive no responses, we will proceed with the cancellations. Please distribute this memo to all interested parties within your group. Chiricahua I LLC (Company #1382-CHRI) Chiricahua II LLC (Company #1383-CHR2) Chiricahua III LLC (Company #1384-CHR3) Chiricahua IV LLC (Company #1385-CHR4) Chiricahua V LLC (Company #1386-CHR5) Chiricahua VI LLC (Company #1387-CHR6) Chiricahua VII LLC (Company #1388-CHR7) Chiricahua VIII LLC (Company #1389-CHR8) Chiricahua IX LLC (Company #1390-CHR9) Chiricahua X LLC (Company #1391-CHR10) Chiricahua XI LLC (Company #1392-CHR11) Chiricahua XII LLC (Company #1393-CHR12) Chiricahua XIII LLC (Company #1394-CHR13) Chiricahua XIV LLC (Company #1395-CHR14)	1
Dale Rasmussen - NETCO	Mark, Dale - NETCO or Estate? Traders and marketers here like him.	0
Bankruptcy Document	All, Jim requested I get everyone a copy of the bankruptcy document he referred to in Tuesday's meeting. Can you please confirm your current location so that I can send you a copy or if you prefer to have a copy picked up, my location is EB4522.	0
Gil Melman's Assistance in the Asset Disposition World	Rex: Would you take exception to my pulling Gil into some of our M&A activities? A number of them (for example, NEPCO) fall within the Dick Lydecker world and I would think this makes sense as we organize our efforts to sell investments/assets/businesses.. Please advise.	1
MANAGEMENT COMMITTEE - OFFICER ELECTIONS	IF THERE ARE ANY MANAGEMENT RECOMMENDATIONS FOR NEW OFFICERS OF ENRON CORP. OR ITS DIVISIONS PLEASE ADVISE BEFORE WEDNESDAY, DECEMBER 19TH IN PREPARATION FOR THE BOARD OF DIRECTORS MEETING. THANK YOU.	1
FW: ECTRIC Capacity	Any insights on how to get a letter? This client wants to novate a series of SEK denominated pulp trades which would generate around $10 mm in revenue for ECTRIC.	1
Reminder of weekly update for Horton	Hope everyone had a great holiday. A friendly reminder of the weekly update of key points (Cindy's email message of December 19th) for Stan. Please forward your update to me and I will consolidate into report. Thank you to those of you who have already forwarded weekly update. If you have any questions, please call me at x33597.	1
FW: Midwest ISO Training Registration Forms	Hello Guy's, FYI, Do any of your people need this training for the MISO start-up. Keith -----Original Message----- From: =09"Deb Lang" <DLang@midwestiso.org>@ENRON =20 Sent:=09Thursday, October 11, 2001 4:29 PM To:=09markettrials@lists.midwestiso.org; misotransowner@lists.midwestiso.or= g; Angeline Protogere (E-mail); Bill Radio (E-mail); Carol Douglas (E-mail)= ; Chris Schoenherr (E-mail); Chris Tryba (E-mail); Cris Anderson (E-mail); = Crystal Livers-Powers (E-mail); Dave Vincent (E-mail); David Dahlberg (E-ma= il); Deb Mirasola (E-mail); Doug Bennett (E-mail); Erik Olson (E-mail); Geo= rge Minter (E-mail); Glenn Schneider (E-mail); Jackie Olson (E-mail); Jeff = Whiteside (E-mail); Jill Amstutz (E-mail); Julie Aho (E-mail); Kandace (E-m= ail); Kerry Spees (E-mail); Larry Burns (E-mail); Leslie Post (E-mail); Lin= da Donlin (E-mail); Lorie Kessler (E-mail); Maripat Blankenheim (E-mail); M= ary Sandok (E-mail); Mike John (E-mail); Mike Mooney (E-mail); Neal Johnson= (E-mail); Rae Williams (E-mail); Rick Moore (E-mail); Russ Reno (E-mail); = Steve Kinney (E-mail); Steve Kraus (E-mail); Steve Miller (E-mail); Steve V= an Dyke (E-mail); Therese LaCanne (E-mail); Todd Steffen (E-mail); Tom Hint= gen (E-mail); Walt Kramer (E-mail); Benny Naas (Trans Ops) (E-mail); Bill H= orton (E-mail); Bob Pettijohn (E-mail); Carroll Waggoner (E-mail); Charlie = Martin; Christopher Plante (E-mail); Craig Drew (E-mail); Darrell Goodson (= E-mail); Darryl Yohnk (E-mail); David Mousseau (E-mail); David Oakland (E-m= ail); Debbie Lancaster (E-mail); Donald Malecek (E-mail); Doug Rempel (E-ma= il); Fred Durham (E-mail); Gary R Hermon (E-mail); Gerry Arnason (E-mail); = James Maenner (E-mail); James Stone (E-mail); Jay_D_Dibble (E-mail); Jim Ha= ll (E-mail); Jim Lauby (E-mail); Joe Mammen (MP) (E-mail); John Mason (E-ma= il); John Rembold (E-mail); John Williams (E-mail); Kathleen Moloney (E-mai= l); Comeaux, Keith; Keith Thompson (E-mail); Kerwin Grider (E-mail); Kurt D= ickinson (E-mail); Larry Thorson (E-mail); Lee Kittelson (E-mail); Mark Mye= rs (E-mail); Mark Rogers (E-mail); Patty Denny (E-mail); Paul Steinberger; = Peg Abbadina (E-mail); Rick Rucker (E-mail); Ron Maki (E-mail); Stephen J B= euning (E-mail); Steve Hillman (E-mail); Steve Hinds (E-mail); Steve Tegtme= ier (E-mail); Talaya M. Dendy (E-mail) (E-mail); Terrie Taylor (E-mail); Ty= Severson (E-mail) Subject:=09Midwest ISO Training Registration Forms Attached please find registration forms for four of the Midwest ISO's upcoming training sessions. Please note that several dates and locations are offered for each course. Due to limited space availability in some locations, the Midwest ISO does reserve the right to limit attendance. Beginning Oct. 24, the Midwest ISO will offer the following: *=09Conducting Business with the Midwest ISO - for power marketers (Conducting Business with the Midwest ISO.doc) *=09Transmission/System Operator Training: Security Process, Outage Scheduler, AFC Process (Trans_Sys_Op_Security_Process.doc) *=09Transmission/System Operator Training: Electronic Scheduling System, Tariff Administration (Trans_Sys_Op_ESS_Tariff.doc) *=09Transmission/System Operator Training: Electronic Scheduling System Only (Trans Op. Training ESS.doc) Information will be posted on the Midwest ISO's extranet training page (http://extranet.midwestiso.org/training) later this week. At that time, you will be able to register for the courses on-line. In the meantime, please send your registration forms via e-mail to training_registration@midwestiso.org. Please contact Deb Lang at 317-249-5474 or Kelli Williams at 317-249-5439 if you have any questions. Thank you, Deb Lang Midwest ISO Administrator, employee and member communications Training Facilitator 317-249-5474 (telephone) 317-249-5910 (fax) <<Conducting Business with the Midwest ISO.doc>> <<Trans Op. Training ESS.doc>> <<Trans_Sys_Op_ESS_Tariff.doc>> <<Trans_Sys_Op_Security_Process.doc>> - Conducting Business with the Midwest ISO.doc=20 - Trans Op. Training ESS.doc=20 - Trans_Sys_Op_ESS_Tariff.doc=20 - Trans_Sys_Op_Security_Process.doc	1
MISO Losses - News and an Important Question	Good news. It sounds like MISO will offer a way to handle losses financially. Based on their previously filed tariff, it appeared that they would not, but it seems they have reconsidered and recently filed a new Attachment M that details how they will handle losses financially. I have not yet seen the new Attachment M, so it may be a complex or costly process, but hopefully, it will be fine. Now, for the Important Question. MISO does not believe they will be able to process third-party loss schedules (either INT or EXT, in Tag parlance) on Dec 15. I don't think this is an issue for us (I expect we will typically be either accounting for losses financially or through in-kind schedules (dropping off losses along the path). If this is not correct, and we do sometimes schedule in losses under separate transactions, please let me know ASAP. Also let me know how prevalent that practice is. MISO is trying to figure out how urgent the need is to accommodate that on Dec 15. While they don't believe they will be able to meet that deadline, they want to know how many resources they should allocate to addressing the problem. Thanks,	1
Curtailments of Stacked Transmission	Attached is a presentation for your review that illustrates a new method for curtailment of transactions that is still based on CPM, but give partial-credit for varying levels of firmness in a stack. As you probably know, when a transaction leg is supported by multiple transmission reservations it is referred to as a "stack" of transmission; specifically, a vertical stack. Under the current curtailment procedures under which we operate, such a stack is always valued at the LOWEST curtailment priority of the stack. In other words, if I combine 50MW of firm transmission and 50MW of Non-Firm Secondary, my 100MW of transmission capacity is now treated as if it ALL had a curtailment priority of 1. Further, if an off-path constraint occurs, the entire transaction is treated with a priority of 1, even if every other leg is Firm. As I'm sure you can see, this stinks. So I have drafted up a proposal for what I think is a better way of doing this. Under the proposal, 50MW would be treated as priority 1, while the other 50 would be treated as Firm. This would reduce the SIZE on-path curtailments and off-path curtailments. As far as whether it increases or decrease the NUMBER of transactions curtailed, that will depend on several different factors (how prevalent stacking is, how often stacks vary in firmness, etc...). Please review and give comments, as I plan to present to the IDCWG in a few weeks. It is my opinion that this is a good idea, but I want to make sure you all (and any others you think should be asked) agree.	1
EWS Client Satisfaction Survey - Reminder	Last week you were sent an EWS Human Resources survey. Your input is very valuable to us. Please take a moment to complete this survey by Friday, June 15th. Please direct any replies to "EWS Human Resources" Please click on the link below. Experiencing technical problems? If this link does not automatically launch the questionnaire: 1. Launch by copying the link into your browser, or 2. If you continue to have technical difficulties, please send an email message to confirmit@enron.com 3. Please do not forward this link to anyone else, as it is unique for each respondent. Thank you http://etcsurvey.corp.enron.com/wi/p0630528/i.asp?r=711&s=HJLUHHJA&l=9	1
RE: Flood Workers	Guys John has come up with a great idea below that I will act on for you all. However I need a rough estimate of who was in over the week end and the extra hours they put in ect. If you could give me a rough estimate of business that was done during the week end will also help our story. I will get the forms from Kim and have her review as she is on the committee that review these personnel best requests, so she no's what to put in that will really work.	0
Entergy interconnect agreement	Please let me know if you would like a copy of the agreements that were accepted by FERC as described below. Susan Scott Lindberg sscott3@enron.com 713.853.0596 Entergy Operating Companies. ER01-1996-000. Interconnection and Operating Agreement and Generator Imbalance Agreement. On June 6, 2001, FERC issues an order that accepts Entergy Services, Inc.'s (Entergy), acting as agent for Entergy Gulf States, Inc., May 8, 2001 filing, which includes: 1) an executed interconnection and operating agreement between Entergy Gulf States and Borden Chemicals and Plastics Operating Limited Partnership, Debtor-in-Possession (Borden) and 2) a generator imbalance agreement with Borden. Requests for Rehearing due July 6.	1
FW: Power World Training	Folks, Please let Lance and myself know if any of you are interested in attending the Power World training. Power World provides visual representation of an optimal power flow model that can help make decisions regarding potential TLR's and price impacts of congestion. We have the program now and the intent is to make more use of it over the next few months and as RTO's and congestion pricing becomes more prevalent. Thanks,	2
FW: RATA and Compliance Testing	Juan, Per the e-mail below, New Albany is requesting the dispatch of two units (120 MW) for 10 to 12 hours on Aug 14, 15, 16 & 17 for Permit testing. This testing is necessary. Please advise if this is a problem.	1
2- SURVEY/INFORMATION EMAIL 5-17-01	Current Notes User: To ensure that you experience a successful migration from Notes to Outlook, it is necessary to gather individual user information prior to your date of migration. Please take a few minutes to completely fill out the following survey. Double Click on document to put it in "Edit" mode. When you finish, simply click on the 'Reply With History' button then hit 'Send' Your survey will automatically be sent to the Outlook 2000 Migration Mailbox. Thank you. Outlook 2000 Migration Team -------------------------------------------------------------------------------------------------------------------------------------------- Full Name: Login ID: Extension:	0
RE:	yes, we are getting the central report. is there any way you can leave the points blank in the national e-mail that i'm getting in the separate central e-mail?	1
Gas Curve	Peter Richard Lewis suggested I contact you in order to obtain a copy of the Houston gas desk curve. We specifically want to understand how the curve escalates from around 2007 onwards as we are looking to rvise our back-end curve. Could you please provide a recent curve. Thanks	0
FW: ERCOT Zone delivery point text modification	These are the descriptions of the bal day product we want on eol as soon as possible. Can you verify they make sense to you.	1
AOL IM Name	What's your AOL IM name?	1
Christmas Lunch	It's that time of year again, wanted to get everyone's comments on having a Christmas lunch, with all the women on the west desk. Dates suggested for having it are December 13 or 14th. Janie suggested having it at Zulas. I'd like to get everyone's feedback on having it, the date you like best, and any different restaurant suggestions. Last year we had a $15 limit on gifts. Also, should we invite Kim Ward and Stephanie Miller, they are part of the west desk. If I left anyone off the list, please let me know	0
LOC update	PW line has a deficit of about $2.1 million. We are on day 3. We might have to fund the account around $2 million if it doesn't cure itself by tomorrow. Can we use the Enron line again now that it is paid-off or would you rather use one of the other lines? BA has approximately $5.9 million available, which has the most availability of all the lines. Please advise. - Beau	1
Forum	I am looking for one or two more interesting topics or presenters for the next forum. Does anyone have any ideas or topics they would like to see covered by anyone? Please let me know if you have any suggestions. Bob Dussler is going to give an update on the Texans....and if Ken is able to attend, we all will want him to update us on the national energy situation. We have had some great presentations...thank you to those involved!! Richard	2
