subject	body	cluster_id
Joe Hubach of Texas Instruments	David and Jim: I spoke with Joe Hubach today and he is very interested in becoming a part of the new Tech Law Center. Joe is expecting your call, Jim, and David you might want to follow up and invite him to lunch. He said he would do his best to attend the ICLC Advisory Board meeting and the Symposium this year, too (no doubt mainly to hear Jim's talk!) His contact information is as follows: Joseph F. Hubach Senior Vice President and General Counsel Texas Instruments Incorporated 12500 TI Boulevard MS 8658 Dallas, Texas 75243 Tel: 214.480.6030 e-mail: j-hubach@ti.com Assistant: Carla Morey Let me know if we can provide you with any additional assistance in this regard. Best regards.	2
Ernst & Young	A friend of mine, Jim McCloskey, a Director at Ernst & Young, mentioned to me that one of his partners and former Vice Chairman of E&Y, Bob Herdman, was recently named Chief Accountant to the SEC and asked whether E&Y could be of any assistance with respect to the present SEC inquiry. I told Jim that I would convey his request to the appropriate personnel. If you or any one wanted to discuss this matter further with Jim he can be reached at 713-750-8206. I do know that Jim had met with Jeff Skilling earlier this year to talk about opportunities in E&Y working with Enron and I think he has another meeting scheduled in November with Rick Causey and others for a follow up presentation, all unrelated to the SEC inquiry. Regards, Scott Dieball	2
Bankruptcy Management Committee	In an effort to better organize the activities and minimize the expenses related to the Chapter 11 filing, we have formed the Bankruptcy Management Committee. There are many outside firms representing multiple parties that will be requesting, among other things, certain tasks to be performed, filings with the bankruptcy court, financial analysis and general business information. To ensure these activities are coordinated, the Bankruptcy Management Committee will now be responsible for overseeing this process. The following is a list of some of the parties that may contact you directly. If anyone from these firms, or other firms, contacts you related to the bankruptcy, please notify a member of the committee to ensure the efforts are coordinated. All outside firms will be requested to notify a member of the committee prior to contacting other Enron personnel or outside parties, including the court and Creditors' Committee. Firm Relationship Bankruptcy court (i.e. motions, etc.) Creditors' Committee U.S. Trustee Ernst & Young Accountants for the Creditor's Committee Houlihan, Lokey, Howard & Zukin Financial advisors for the Creditors' Committee Blackstone Financial advisors for Enron Batchelder and Partners Financial advisors for Enron Weil, Gotshal and Manges Bankruptcy attorneys for Enron Milbank Tweed Attorneys for the Creditors' Committee Andrews and Kurth Attorneys for Enron Corp The following are the members of the Bankruptcy Management Committee: Ray Bowen - Chairman Bob Butts Jim Fallon Dave Glassford Dave Gorte Mark Muller Julia Murray Lou Stoler Initially, this committee will meet on a daily basis to organize all the bankruptcy related activities as well as to prioritize requests going to the Creditors' Committee and the court. It is extremely important that the company provides accurate and timely information to the court, the Creditors' Committee and their advisors. Accordingly, we request the assistance of all employees and outside firms in coordinating the bankruptcy efforts with this newly formed committee.	2
Re: Enron	Darron, Marketing would be my first choice. Something in HR working in benefits would be second. Thanks for your help SJ (See attached file: resume2.doc) "Giron, Darron C." <Darron.C.Giron@ENRON.com> on 07/20/2001 01:12:56 PM To: <stephen_johns@agfg.com> cc: Subject: Enron Send me your resume and maybe what kind of work you're interested in, and I'll see what I can do. DG - resume2.doc	2
RE: Enron postings	Darron, I have attached a revised resume for you to send to the managers and recruiters if you have not already. Thanks and let me know if you get any feedback. Scott >From: Darron.C.Giron@enron.com >To: scott_crowell@hotmail.com >Subject: RE: Enron postings >Date: Tue, 7 Aug 2001 14:18:13 -0500 > >109423 Recruiter Jennifer Cronin 713-345-8267 > Supervisor Rich Hall 713-345-3389 > >109078 Recruiter Donald Iacobell 713-345-3962 > Supervisor Zhiyong Wei 713-853-3020 > >DG > > -----Original Message----- > From: "scott crowell" <scott_crowell@hotmail.com>@ENRON > >[mailto:IMCEANOTES-+22scott+20crowell+22+20+3Cscott+5Fcrowell+40hotmail+2Ecom+3E+40ENRON@ENRON.com] > > > Sent: Tuesday, August 07, 2001 1:27 PM > To: Giron, Darron C. > Subject: RE: Enron postings > > Don't worry about it. There ended up being mostly people Brook works > with. > Not too many people that I knew. We left and went out around 10:30 and > were > home by 1 am. You didin't miss much. I'll call you about lunch. > > > >From: Darron.C.Giron@enron.com > >To: scott_crowell@hotmail.com > >Subject: RE: Enron postings > >Date: Tue, 7 Aug 2001 07:44:29 -0500 > > > >I'll look at them and get back with you. We ended up staying at this > party > >until 10:30pm. Its funny, because with her, we usually are the last > people > >to leave these types of things and that's why when I was talking to >you > on > >the phone I said would be there until at least 9pm. But K immediately > >said, no we won't be that late. And I was thinking at the time, sure > we > >won't. Sure enough, we were the last ones to leave. Sorry. When I > get a > >chance, I'll look at these jobs. I can do lunch any day. > > > >DG > > > > -----Original Message----- > > From: "scott crowell" <scott_crowell@hotmail.com>@ENRON > > > > >[mailto:IMCEANOTES-+22scott+20crowell+22+20+3Cscott+5Fcrowell+40hotmail+2Ecom+3E+40ENRON@ENRON.com] > > > > > > Sent: Monday, August 06, 2001 11:36 PM > > To: Giron, Darron C. > > Subject: Enron postings > > > > Hey. I was looking on the Enron site and I found a couple of > openings. > > Can > > you see if you can find out the hiring managers for these > positions? > > > > 109423 Spec. Sr. IT Non Dev. - Business Analyst CRM > > 109078 Spec. Sr. IT Dev. - Risk Mgmt. System Development > > > > Thanks. > > > > What happened to you on Saturday night? When can you do lunch >this > > week. I > > promise not to stand you up again. > > > > Scott	2
FW: New Multi-commodity Options Trading Products	Hi, My name is Iris Mack. Currently I work on Enron's Power Options Trading desk. I am primarily responsible for building our business in long-term, derivatives structures/trades on multiple commodities and financials. For example, we are exploring potential structures and trades which involve power, gas, crude oil, weather derivatives, metals, etc. Some of the building blocks for these multi-commodity derivatives products may be found in the attached document. We are looking to build this business via utilizing as many of Enron's internal resources as possible. Hence, it would be most helpful to meet with the relevant individuals in Gas Trading who would be interested in the development of multi-commodity derivatives trades/structures which may used to develop customized risk management tools for our clients. Thank you in advance for your assistance.	1
Birgit's Contact Info: 713-222-7667	Hi Daron, You sure have a big fan in Scott Crowell! I look forward to meeting you and being your "eyes and ears" in the market-place! Some of the positions I'm currently conducting searches for include a Risk Managers (85-100K+B); power-plant accountants (50-60K+B); Gas Schedulers (55-70K. To help me better understand your interests, please take a few minutes to answer the following questions, and/or email me a copy of your resume (which I will help you up-date) so I can match you to opportunities. 1) Key requirements in your next position. 2) Main areas of expertise/ years experience (n/a if resume attached) 3) Current and desired compensation 4) Key reasons you would consider leaving your current employer & your level of urgency in making a move: 5) Companies you want to avoid working for and/or already have your resume: 6) Companies you're interested in: 7) Main achievements in your career (or we can cover this if we meet; our offices are located downtown on 723 Main Street, suite 511 at the corner of Main/Rusk, in the Houston Bar Center Bldg): Please note that our team of 8 recruiters are Big 5 Alumni and CPAs specializing in Accounting (including Tax), Finance and Risk Management. I look forward to working with you in the near future and answering any questions you might have. You may reach me anytime at 713-222-7667, or we could schedule a time to talk in the evening. All our conversations will be completely confidential. Best wishes,	0
Mr. Heffner	Mr. Griffith, Hello my name is Garth Camp and I am a close friend of Jeb Ligums. I wanted to first thank you for the contact at Carr Futures, Mr. Heffner, I really appreciate it. At this point have have emailed Mr. Heffner a few times. I know that he must be busy, however, I would like to know if he received my emails, resume and cover letter. I know you have been kind enough for the connection, I was wondering if you could help me find out if Mr. Heffner did receive them. I wanted to thank you again for your time and your help. If I do need to resend information please email me at garthcamp@hotmail.com, or call (860)582-2275. Sincerely, Garth Camp	2
First Call	John, My name is Adrian Clark, I am an executive recruiter in the energy industry. One of my industry sources gave me your name but was not specific as to what you do for Enron. My firm, First Call Associates, is currently doing a search for qualified front office personnel to present to our clients. I would like to know more about your background so I can discuss potential new job opportunities if you are interested. If the timing is not right for you at this time, I've included my contact information for future reference. You can find more information about my firm at www.firstcallassociates.com. We are very familiar with the nuances of the energy trading business and have built relationships with many energy companies in North America enabling us to present qualified employees for their consideration. Be assured that any information we discuss will be completely confidential. My apologies for sending this to your email at work but I have not been able to reach you by telephone during business hours. Adrian Clark	0
Microsoft	Microsoft's in-house counsel called me on my cell phone a few minutes ago. He just wanted to let me know that they received our proposal this morning and that they have retained Preston Gates & Ellis LLP to assist them in reviewing and analyzing our proposal. He said they would be getting back with us shortly -- hopefully tomorrow -- and said that his business folks where intent on moving "forward instead of backward," whatever that means. Talk to you soon. Andy	2
-	Mark: I spoke with Richard this afternoon briefly. Please let me know if there is anything we can do to assist you or your other counsel on anything or if you just want to bounce any ideas around. In light of our relationship with the company, we obviously want to do whatever we can to help out at this difficult time. John	2
SEC inquiry regarding hedging through limited partnerships	You may recall that I flew in from San Francisco to meet with you last September to interview for an attorney position to work on the commoditization of broadband. You were interested in me because I had traded futures as a broker prior to my career as a lawyer. I was sorry to hear through a headhunter that Enron had disbanded the group. (Robbi, I hope that you recovered from your house fire.) To cut to the chase, I have read in the news about the SEC investigating Enron and its derivatives trading with two of its LP's, which I gather was extremely profitable. I wondered if there was an opportunity to finally work for Enron. I understand how swaps work, have conducted financial investigations and have securities litigation experience, albeit all on a smaller scale than you are operating on. I have gas swaps experience as a lawyer at TransCanada Energy Ltd. I worked for the Alberta Securities Commission assisting them in an investigation into a market manipulation. I also used to sue the major brokerage houses on a contingency basis for outrageous acts committed by their brokers when I had my own practice. I have been looking for an opportunity to work with swaps and specialize in the law with respect to derivatives. I am available immediately and would be willing to work on a contract basis. If you think that I could help, my number is 403-241-7293.	1
FW: Career Opportunities at Enron	FYI re my voice mail to you. Jim -----Original Message----- From: pincussr@nmenergy.com@ENRON Sent: Wednesday, October 17, 2001 2:04 PM To: jderric@enron.com Subject: Career Opportunities at Enron Dear Mr. Derrick: Les LoBaugh suggested that I contact you to inquire about an in-house counsel position at Enron. I am the General Counsel of Niagara Mohawk Holding's unregulated subsidiaries, Niagara Mohawk Energy, Inc. and Niagara Mohawk Energy Marketing, Inc. We expect the sale of Niagara Mohawk Energy Marketing to close in November or December of this year, pending FERC approval, and a sale of Niagara Mohawk Energy's Distributed Power and Energy Services Business units may occur contemporaneously with that closing. Therefore, I am now pursuing other career opportunities. I am a good candidate for an in-house counsel position at Enron because of my 12 years experience as an attorney in the energy industry. As General Counsel for the Company, I provide legal services and business advise to senior management and the Board of Directors of both the energy marketing and the energy services subsidiaries. My experience includes drafting and negotiating gas and electric retail sales agreements and master agreements and related documents for wholesale energy trading and marketing transactions, including physical transactions and financial instruments such as swaps. I monitor and I am responsible for representing my company in FERC and state regulatory proceedings. I keep up to date on the fast moving events and trends in the energy marketing and trading industry by closely monitoring regulatory proceedings, reading information that is published in trade and related energy industry publications and my involvement with the National Energy Marketers Association and the Federal Energy Bar Association. I am also responsible for representing the company and managing outside counsel in litigation and alternative dispute resolution proceedings. My experience includes utility regulatory and legal matters, the transactional work associated with corporate mergers and acquisitions, corporate governance, human resource/employee issues, interconnection agreements, municipal law, leasing, financing and secured transaction agreements, commercial contracts, condemnation litigation and real property matters. I have attached my resume for your review. Please contact me at your earliest convenience to schedule an interview. I look forward to hearing from you soon. Thank you for your consideration. Very truly yours, Steven R. Pincus	0
Jeff Huff Resume	The resume for Jeff Huff was inadvertently dropped from the message we sent yesterday evening. The resume is attached below for your convenience. Below are a few points for your review: Resume: Currently the second most productive Partner at Diamond-Cluster, a technology consulting firm. He has been a consultant dedicated to Enron for the last 2+ years, first for Tom Gros in EBS and Net Works and then for Dan Reck in Freight, developing trading systems. The Job: We are looking to bring Jeff in as VP, Commercial Support. The demands of growing the group require a consistent focus on technology, expenses, front and back office productivity, as well as constant re-analysis of growth strategies. Justification: Jeff's capabilities in these areas make him extremely qualified. We rely on him heavily already, but at consulting rates he costs us more than $1.3mm per year and his focus is limited to technology. Most importantly, the lead commercial folks in the group are overburdened with administrative issues and spending too little time bringing in earnings. Thank you. Mike and Jeff	0
Hello from MSU	Hi Mark. I know that you are busy with critical Enron business matters now. I don't want to intrude on your time at this critical juncture. I do want to wish you much luck and success in getting things worked out. When things settle down, I would enjoy having an opportunity to continue our discussion. I appreciated your willingness to speak with me earlier this fall. Thanks for your consideration. And if I may ever be of help to you, please don't hesitate to contact me. Best regards, John	2
New Staff Member	Please join me in welcoming Alexandra Gage, who will join the ISDA New York office on Tuesday, December 4. Alexandra will be the Administrator for Research and Policy reporting to David Mengle and Stacy Carey.	0
FW: Resume for Job Posting #0000108727	Don/Juan: Jackson is interested in your position. Please advise of your interest. Thanks, Johnny	0
Important Message	It is my sincere honor to once again lead the Enron team in this year's Juvenile Diabetes Research Foundation (JDRF) Walk scheduled to take place on Sunday, October 28th, at Greenspoint Mall. I continue to serve on the board of JDRF representing Enron and will be Enron's corporate executive for this year's fundraising efforts. As many of you may already know, I am an insulin dependent diabetic myself. Even though I know how difficult this disease can be to manage with the multiple finger pricks for blood samples and several shots each day, I cannot imagine how difficult it is for a small child with this disease. Taking insulin does not cure the disease nor prevent the development of complications; insulin is simply their life support system and without it they would die. Enron continues to be a major corporate sponsor for JDRF again this year. JDRF is a very efficient organization in which approximately 85% of all money raised goes directly to research. Enron's goal this year is to raise $400,000 and we need your help. Enron has been the number 1 walk team for 6 years in a row and we are not ready to give up first place! We need team leaders, walkers and volunteers to help us reach our goal. The theme for the walk this year is "Mission: Possible" and we would like to have you join us for this great event. The Walk is truly a blast and we had about 600 Enron people participate last year and everyone enjoyed it. If you are interested in volunteering to be a walker or a team leader, or if you would like to make a pledge, you may call any of the steering committee members listed below. If you are interested in being a team leader, please contact one of the following people immediately so that you may be included in the first important and informative training session taking place this week. In addition, you may go to cr.enron.com and sign up as a volunteer online if you prefer. Thank you very much for your support. Mike McConnell Steering Committee Members: Cathy Phillips X36898 Angela Sprock X36335 Jennifer Milligan X35272 Janice Riedel X37507 Debbie Yates X35305 Kendra Dromgoole X58981	2
Hey there!	Juan, How are you? I ran into Jaime Bustos last week and your name came up. How's the family? Any more kids? We're doing well in Louisville. You may already know this, but Sterling and I started a company a few years ago that provides information to the energy markets on plant output. Pretty interesting stuff. Anyway, give me a call when you get a minute. I understand that you're on the 24-hour desk and I would like to get your feedback on a few things related to our business. I can be reached at (502) 645-5252.	0
Our Previous Discussion	Juan / Don: Per our conversation on August 9, my manager, Jeff Sorenson, returned from = London on Monday (8/27). Today, Jeff and I discussed our conversation and = my desire to pursue opportunities within your trading group. Jeff's positi= on on my pursuit of other opportunities was positive. Jeff stated that he = did not want to prevent me from pursuing my interests within Enron. If I c= ompleted the interview process and was given the opportunity to join your g= roup, Jeff expressed a concern over the desired time period for a transitio= n and finding additional staff to fill my current responsibilities. This i= s not an area that we discussed in detail, thus I informed Jeff that I woul= d provide him with some additional details. If the opportunities are still= available, I definitely want to pursue them further. I'll will contact yo= u on Wednesday to discuss any further details. If there is a particular ti= me that is more convenient to talk, please let me know. Thanks again, and = I looking forward to meeting with you again.	2
New investment tools at American Century	Please respond to American Century Update Dear Priority Investor, At American Century, we believe in helping shareholders achieve their dreams. Having the tools to develop a solid, long-term investment plan that meets your individual goals is a great way to start. Recently, Bob Puff, President of American Century Investment Management sent you a copy of our Taming a Bear Market brochure. We hope you have found this brochure to be helpful in evaluating and refining your investment plan. If you would like additional information, or to learn more about asset allocation, dollar cost averaging, and diversification, you may visit us online at http://www.americancentury.com/info/tools. It is a pleasure to have you as an American Century Priority Investor. Please feel free to contact us at https://www.americancentury.com/contact Sincerely, Mark Killen Senior Vice President American Century Investment Services, Inc. ****************************************************************** Any information you provide American Century is kept confidential. Read more about privacy and security in American Century's Privacy Principles at http://www.americancentury.com/sitehelp/topic.jsp?topic=privacy_security You are a valued investor. If you received this message in error, or prefer not to receive email announcements of new services, please go to https://www.americancentury.com/accounts/unsubscribe.jsp to unsubscribe. If you have difficulty with any of the above links, you can copy and paste the address directly into your browser's address field. American Century Investment Services, Inc. ? 2001 American Century Services Corporation.	2
Organization Announcement	Organization Announcement It is my pleasure to announce that Kenneth Lovejoy has joined Enron Corp. EH&S Asset Operations. He will be reporting directly to Donnie Willmann and will support Central America, Caribbean and EES. Ken has over 25 year experience in environmental, health and safety for the oil and gas industry. He has been working for Enron since 1996 and has extensive international experience. We are excited to have Ken in our team so, please welcome Ken in his new role.	2
What does it take?	LLoyd Will and Kim Melodick have requested your help in identifying what YOU feel it takes to be successful within each functional unit of East Power. This feedback will be used to create a recruiting, retention and development tool that will assist East Power in identifying the skills and training that are key to your group's success. Please take some time to answer the attached four questions as they relate to your area. Your participation and cooperation is greatly appreciated.	2
Calif.'s Energy Future	Dear Ken, I hope you 'visit' with the Governor was as fruitful as mine. we are very favorably supported in our development of a Regional Energy Efficiency Initiative ... an approach to defining and delivering sustainable energy efficiency. (not conservation!) There is an opportunity to discuss a way in which Enron could perhaps become involved in a very significant set of new developments within the sphere of influence in which I operate. If you wish to 'look into' this .. let me know. I believe such an endeavor during this difficult time might well stand you in good stead .. and its a way to enter the end use services business. I look forward to getting to Aspen for the AI conference. John	2
Speaking Invitation	Dear Mr Lay Eyeforenergy Asia 2001 takes place at the Shangri La Hotel in Singapore, 15-17 October. It is the follow-up to last year's e-Business for Energy Asia Pacific, which also took place in Singapore, and will be the meeting-place this year for the senior energy executives in the region to discuss all the latest developments in the industry - e-business, regulatory change, and the subsequent financial impact on both the new and old economies. I would like to invite you to give a keynote presentation at the conference. I have attached the full program. We expect 150 very senior delegates from across the energy industry, from Asia and beyond - oil and gas co's, but also electricity utilities, as well as exchanges, analysts and investors. Speakers will come from companies such as Caltex, BP, Shell, Petronas, Premier and Texaco, and, hopefully, Enron. If you have any questions at all, or would like to discuss your presentation in more detail, please do not hesitate to give me a call or drop me an email.	0
